record_ID,Description,Status
52145,Temporibus dolorem error amet dolore. maintenance,decommissioned
23443,Necessitatibus distinctio vitae reprehenderit nemo. maintenance,functional
12404,Ratione iste delectus dolore beatae. maintenance,decommissioned
65990,Quidem unde provident quibusdam adipisci eligendi quidem. maintenance,decommissioned
48518,Culpa totam consectetur veritatis facilis consequuntur officia. maintenance,decommissioned
50787,Quae possimus neque minus nostrum. maintenance,repair
60833,Nulla atque enim iste. maintenance,functional
99690,Quidem asperiores perferendis vel dolor earum sunt. maintenance,decommissioned
6539,Doloremque unde in sapiente sequi voluptatum. maintenance,decommissioned
70266,Reprehenderit nobis ab eveniet eligendi deleniti omnis. maintenance,repair
44267,Beatae sapiente minima magnam vero est dolorum. maintenance,functional
20714,Temporibus nihil sed magnam doloribus veniam autem. maintenance,repair
76271,Error consequatur dolorum eum nemo magni quidem neque. maintenance,decommissioned
72319,Fugit suscipit ex veniam. maintenance,functional
56181,In molestias aspernatur occaecati alias. maintenance,repair
81772,Alias aspernatur omnis repudiandae dicta. maintenance,repair
86826,Accusamus magni repellendus neque. maintenance,decommissioned
24985,Id debitis cum corrupti quisquam quia. maintenance,decommissioned
13426,Cum dolorum nobis praesentium quidem suscipit ratione. maintenance,decommissioned
52554,Unde nam minus sint numquam sunt. maintenance,decommissioned
95720,Porro rerum nulla saepe eius. maintenance,decommissioned
68710,Iste beatae impedit excepturi quos ad ad. maintenance,decommissioned
28373,Nulla totam repellat nobis adipisci modi corporis. maintenance,decommissioned
81759,Debitis fugit accusamus ducimus aliquam placeat. maintenance,functional
68183,Quae quaerat distinctio expedita. maintenance,functional
85230,Architecto cumque deserunt veritatis aut quae. maintenance,decommissioned
62396,Fugit eaque similique aperiam harum. maintenance,decommissioned
9310,Laudantium ut facilis deserunt modi consequuntur natus. maintenance,decommissioned
39145,Beatae explicabo quis temporibus quam sint accusantium necessitatibus. maintenance,functional
719,Vel dignissimos soluta quod beatae excepturi officia. maintenance,decommissioned
33616,Officiis corporis fugit tenetur omnis aut maiores. maintenance,decommissioned
80841,Ipsam est dolorum tenetur libero unde maiores. maintenance,decommissioned
84907,Blanditiis ullam minima vero commodi recusandae sequi. maintenance,decommissioned
44483,Pariatur impedit velit aperiam. maintenance,functional
21574,Repellendus deleniti ratione ut perferendis a possimus. maintenance,functional
11468,Nulla voluptates laboriosam beatae nobis delectus. maintenance,repair
31134,Labore quos rerum occaecati quod numquam expedita. maintenance,repair
32854,Ab dolor expedita odio alias nam. maintenance,repair
65063,Soluta omnis culpa sapiente veniam molestias tempore. maintenance,functional
25036,Ratione impedit quibusdam aut suscipit. maintenance,repair
81808,Molestiae libero minus autem saepe. maintenance,decommissioned
1396,Odio quidem iste illum natus iure. maintenance,functional
94992,Minus sapiente eaque vel laborum. maintenance,decommissioned
10535,Corporis occaecati officiis consequuntur vero similique. maintenance,decommissioned
17116,In dolore quia. maintenance,repair
38870,Reprehenderit sit nisi nostrum sed consectetur. maintenance,decommissioned
55133,Illum deserunt eum vitae voluptatum aperiam. maintenance,decommissioned
72761,Dicta voluptates quia at quae accusamus in. maintenance,functional
18108,Assumenda natus facilis recusandae illum odit iure culpa. maintenance,functional
66070,Neque sunt minus voluptatem quod. maintenance,functional
25492,Quas saepe impedit facere unde culpa. maintenance,functional
42231,Nisi eos corrupti id laboriosam eligendi veritatis. maintenance,decommissioned
83813,Consequuntur iste laudantium deserunt fuga. maintenance,decommissioned
39113,Error occaecati iste quo perspiciatis dolorem. maintenance,decommissioned
29791,Voluptatem maxime commodi fugiat qui reiciendis voluptate praesentium. maintenance,functional
4728,Fugit eius earum facere quia modi voluptate. maintenance,functional
65946,Quaerat necessitatibus unde. maintenance,functional
8845,Deserunt amet sed veniam saepe tenetur nam. maintenance,decommissioned
33118,Cumque reprehenderit dolorum incidunt fugiat. maintenance,decommissioned
34520,Tempore non totam occaecati necessitatibus harum qui. maintenance,decommissioned
80554,Eaque officiis expedita quidem impedit nihil placeat. maintenance,repair
60230,Repudiandae aut a fugiat. maintenance,decommissioned
48261,Modi corrupti omnis laudantium nihil aut cumque dolorum. maintenance,repair
93245,Temporibus saepe dicta odit voluptatum harum. maintenance,repair
45905,Voluptatibus earum quod natus sint. maintenance,functional
19904,Reiciendis magni corrupti cum dolor. maintenance,decommissioned
64619,Doloremque dolores veniam iure. maintenance,functional
10336,Veritatis eos porro rem laboriosam laudantium aliquid quibusdam. maintenance,decommissioned
9464,Corrupti dolore voluptatem eius eaque explicabo vitae et. maintenance,repair
66589,Aliquid perspiciatis vel iure ratione occaecati nulla. maintenance,functional
10169,Eius quo sunt quae doloribus. maintenance,decommissioned
77836,Dolores asperiores quisquam impedit nulla. maintenance,repair
63342,Reiciendis tempora natus voluptatum fugit beatae. maintenance,repair
4287,Itaque nulla animi molestiae in assumenda asperiores. maintenance,functional
85754,Mollitia distinctio cum ullam a. maintenance,decommissioned
61948,Nam deserunt labore delectus nobis amet id. maintenance,repair
54247,Quaerat distinctio sit tenetur ratione. maintenance,repair
56677,Veritatis ducimus molestias temporibus velit. maintenance,repair
58726,Maiores blanditiis explicabo nam magnam inventore saepe. maintenance,functional
72126,Possimus consequatur ab fugit quo beatae at. maintenance,decommissioned
4398,Occaecati dicta dolore iste impedit eaque esse. maintenance,decommissioned
38723,Eligendi et ea hic deserunt. maintenance,decommissioned
75517,Nisi ex consequuntur nobis qui odio cupiditate. maintenance,functional
58346,Nobis consectetur sit aperiam. maintenance,functional
8230,Natus excepturi ut vitae. maintenance,decommissioned
88875,Error dolor provident illum incidunt. maintenance,repair
11793,Expedita ipsum totam aliquam sit. maintenance,repair
18081,Veritatis in laborum ipsa quidem aut. maintenance,repair
1349,Laborum maiores ut non debitis voluptate. maintenance,functional
71714,Quisquam laborum natus maiores eius cumque veritatis nihil. maintenance,repair
70672,Eius voluptas eligendi culpa nobis. maintenance,decommissioned
46776,Architecto sint atque ab asperiores quasi. maintenance,decommissioned
54891,Deserunt sint voluptatem beatae. maintenance,repair
34068,Eos ut tenetur modi ex sapiente perspiciatis. maintenance,functional
49467,Magni laudantium error. maintenance,decommissioned
16990,Minima quae veritatis tempore quos dolores. maintenance,functional
80107,Facere perspiciatis facere temporibus perspiciatis quae numquam. maintenance,repair
2826,Quas quod temporibus quis corporis. maintenance,repair
79351,Ducimus dolores voluptate veritatis consequatur aut provident. maintenance,functional
58476,Culpa delectus voluptatem quibusdam consequuntur quo quod. maintenance,functional
74850,Repellendus accusamus rem perspiciatis asperiores quasi deleniti. maintenance,functional
83935,Minus ipsum labore aliquam illo eius distinctio. maintenance,repair
28964,Non dicta commodi neque veniam illum blanditiis. maintenance,functional
8556,At nobis illum necessitatibus. maintenance,decommissioned
87300,Illo sed dignissimos corporis sequi saepe ad. maintenance,functional
55532,Fugiat harum aliquid facere porro adipisci. maintenance,functional
85777,Quibusdam quos rerum facilis non aut pariatur laborum. maintenance,repair
17248,Deleniti commodi similique repudiandae est. maintenance,decommissioned
27529,Nisi quis architecto. maintenance,repair
10181,Velit ad ipsam aliquid voluptatibus. maintenance,functional
96044,Quae vel ipsum odio. maintenance,decommissioned
53520,Omnis blanditiis corrupti voluptas rerum. maintenance,decommissioned
19258,Maiores est aspernatur inventore culpa officiis. maintenance,repair
53771,Dicta assumenda explicabo tempore voluptatem alias nesciunt assumenda. maintenance,decommissioned
24363,Velit rem neque quidem neque nam unde nulla. maintenance,repair
46057,Voluptates eum odit velit et velit ut. maintenance,repair
89706,Velit tempore delectus voluptatum quas error. maintenance,repair
56842,Nobis sed impedit animi exercitationem. maintenance,repair
64443,Aperiam voluptatibus iure possimus. maintenance,repair
83494,Voluptas minus autem natus laborum praesentium. maintenance,functional
70975,Nulla non ut modi adipisci. maintenance,functional
70617,Ullam perferendis voluptate consequuntur ex fuga aliquam voluptatibus. maintenance,decommissioned
30531,Impedit aspernatur ducimus dolorem dignissimos earum. maintenance,decommissioned
44470,Dolorem ut reiciendis nulla rerum sequi. maintenance,functional
63304,Iste consequatur maiores illo laudantium dolor. maintenance,functional
57842,Nam expedita voluptatem. maintenance,decommissioned
96965,Fugiat voluptas vero aperiam maiores odio. maintenance,decommissioned
77155,Reiciendis sit velit animi amet maiores magnam aliquid. maintenance,repair
47707,Delectus at sapiente exercitationem. maintenance,functional
47854,Cum nostrum impedit adipisci commodi beatae. maintenance,repair
39560,Dicta nihil facere. maintenance,functional
36131,Doloremque suscipit incidunt neque animi cupiditate aut. maintenance,functional
39848,Eum voluptates quibusdam. maintenance,functional
70034,Consequatur quasi dolor. maintenance,repair
25004,Suscipit illo quia reiciendis. maintenance,repair
17055,Minima eos culpa eos perspiciatis occaecati. maintenance,repair
97529,Omnis assumenda facilis quos labore. maintenance,functional
35729,Iusto mollitia dolore eum modi laborum. maintenance,repair
51611,Perspiciatis eius aliquam veritatis ex adipisci cum. maintenance,repair
74725,Numquam tempora dicta. maintenance,repair
70060,Aut id odit dolor hic consequatur. maintenance,functional
94692,Accusantium sequi quis possimus. maintenance,functional
96730,Sint odio vitae veritatis qui quibusdam quas quaerat. maintenance,decommissioned
11169,Architecto sed hic minima. maintenance,decommissioned
19181,Nam eius aperiam repudiandae aspernatur. maintenance,repair
55108,Impedit cupiditate quaerat ex delectus. maintenance,functional
91414,Quam consequatur sapiente. maintenance,functional
57288,Impedit facere consectetur eos autem nemo autem tenetur. maintenance,repair
7482,Architecto similique quaerat. maintenance,decommissioned
50123,Nobis veritatis officia. maintenance,decommissioned
49864,Facilis doloribus quae beatae. maintenance,repair
35052,Laboriosam hic reprehenderit vero dicta nemo. maintenance,functional
45779,Occaecati animi saepe aperiam eius quia rerum. maintenance,repair
63617,Optio expedita maxime delectus. maintenance,decommissioned
57337,Porro repellendus tenetur ducimus sunt. maintenance,decommissioned
51607,Ad esse vero dolorum. maintenance,repair
62428,Accusantium officiis accusamus voluptatem molestias assumenda autem. maintenance,repair
36313,Deserunt vero fugiat consectetur voluptates atque. maintenance,decommissioned
30378,Reprehenderit tenetur error amet harum cupiditate nostrum quas. maintenance,repair
24668,Enim accusamus quia dolores. maintenance,functional
83917,Laborum cupiditate odit tempora voluptatibus. maintenance,repair
88480,Iure excepturi alias quis. maintenance,functional
44351,Recusandae culpa sequi veniam. maintenance,decommissioned
44321,Saepe natus cupiditate. maintenance,functional
90711,Facere ut iure omnis. maintenance,functional
78906,Ducimus illum consequatur amet omnis mollitia consequuntur. maintenance,repair
72516,Reiciendis veniam earum illo sed nemo nemo. maintenance,repair
1742,Ullam blanditiis quod nisi dolorum assumenda porro veniam. maintenance,decommissioned
14152,Odio velit aut cupiditate. maintenance,functional
69307,Et esse id facilis harum consequatur natus. maintenance,functional
76688,Similique velit culpa sunt sit. maintenance,repair
48242,Laboriosam aut accusantium quisquam. maintenance,functional
29674,Accusantium dolorum dignissimos fugit. maintenance,repair
89207,Modi blanditiis expedita beatae ipsum libero architecto. maintenance,repair
55324,A molestiae quia dolorum itaque hic. maintenance,repair
18888,Nesciunt eius error eaque dolorum quia. maintenance,repair
89120,Cupiditate hic consequatur ad ut ratione minus. maintenance,decommissioned
53537,Eum nisi officiis illo iusto a eveniet. maintenance,functional
42454,Possimus et doloremque praesentium. maintenance,repair
96227,Aliquam cupiditate dolor rem incidunt voluptate. maintenance,decommissioned
32398,Laborum dolorem consectetur earum odit vero. maintenance,repair
24947,Voluptatum voluptates quas quos nulla et repellendus. maintenance,functional
75599,Quisquam et debitis commodi enim. maintenance,repair
75019,Perferendis provident beatae repellendus saepe iure numquam illum. maintenance,decommissioned
84993,Occaecati fuga amet ratione. maintenance,repair
75560,Unde vel maiores tenetur. maintenance,functional
2581,Et beatae assumenda perferendis dolores. maintenance,decommissioned
82459,Similique asperiores doloremque beatae debitis voluptate itaque. maintenance,decommissioned
86104,Aliquid culpa fugit repellat veniam quia. maintenance,functional
11244,Assumenda dolores sit harum delectus. maintenance,repair
93282,Ipsum voluptatibus recusandae modi itaque dolorum. maintenance,repair
72688,Voluptates fugit aut doloribus quos velit. maintenance,functional
35050,Blanditiis esse inventore minima ducimus nostrum odit. maintenance,decommissioned
42377,Expedita odio occaecati commodi distinctio quae fugit. maintenance,repair
16185,Atque maiores error veniam perferendis maiores. maintenance,decommissioned
28849,Deleniti exercitationem aperiam tenetur eius labore. maintenance,repair
70786,Vero molestiae animi doloremque sapiente sunt quibusdam ut. maintenance,repair
95969,Reiciendis ipsam numquam. maintenance,repair
69066,Aut tenetur laborum illo pariatur. maintenance,functional
80160,Sit alias eos eaque occaecati ratione. maintenance,repair
65618,Aliquam facere cum fugit odit labore. maintenance,repair
4572,Consequatur alias dolor et impedit. maintenance,decommissioned
80680,Commodi architecto ad id blanditiis. maintenance,repair
19758,Maiores repellat est porro ipsam. maintenance,repair
50131,Id numquam libero libero incidunt ut. maintenance,decommissioned
83232,Magnam tenetur debitis beatae sapiente dolore itaque. maintenance,repair
32225,Ipsam iste repellendus delectus. maintenance,functional
62562,Vero repudiandae sint fugiat consequatur. maintenance,decommissioned
40781,Modi dolor est possimus delectus ex. maintenance,decommissioned
98768,Omnis odio adipisci aperiam. maintenance,decommissioned
50952,Voluptatibus illo odio nemo ut iure. maintenance,repair
46064,Veniam mollitia occaecati ipsam error. maintenance,repair
98579,Aliquam magni exercitationem. maintenance,repair
42733,Nisi autem sint nostrum recusandae. maintenance,repair
94536,Deleniti perferendis placeat vitae. maintenance,decommissioned
31800,Quibusdam excepturi nemo ea. maintenance,repair
66337,Sequi est ipsa delectus earum eius dolores. maintenance,decommissioned
83129,Tempora repudiandae quasi deserunt quis. maintenance,functional
82083,Aliquid nobis repellendus harum. maintenance,functional
19887,Adipisci voluptatem molestias blanditiis deserunt repellat quae debitis. maintenance,repair
34809,Doloremque in numquam consectetur. maintenance,decommissioned
69774,At doloribus ex quam dolorum dolor a. maintenance,functional
86938,Hic repudiandae voluptate rerum rem incidunt. maintenance,decommissioned
3647,Repellendus soluta numquam amet est. maintenance,functional
82870,Vero nobis eum neque porro repudiandae saepe. maintenance,functional
98920,Labore nemo nemo enim voluptatibus. maintenance,functional
80871,Dolorum quas temporibus exercitationem voluptatibus sequi sint. maintenance,repair
86597,Ratione animi occaecati ullam ratione expedita possimus. maintenance,functional
91490,Numquam incidunt non asperiores dicta. maintenance,repair
90213,Facere perspiciatis quia nemo eius aliquid ducimus. maintenance,functional
69849,Laudantium laboriosam dolores error. maintenance,repair
78640,Possimus accusamus nulla. maintenance,decommissioned
3939,Cupiditate voluptatum tempore. maintenance,functional
59979,Sint ullam odio consequatur. maintenance,repair
44667,Quis natus iste eligendi pariatur alias eum. maintenance,functional
88827,Error nobis asperiores nulla ratione. maintenance,repair
12708,Sapiente iure sunt veniam sunt labore voluptatem. maintenance,decommissioned
56542,Tenetur totam porro quia labore incidunt. maintenance,decommissioned
36259,Veritatis occaecati ullam quas esse voluptas. maintenance,repair
96966,Sunt ut nulla ducimus illum nostrum provident. maintenance,repair
29888,Quae nemo quas corrupti quisquam quisquam quas. maintenance,functional
11303,Consequuntur velit voluptatem doloribus fugit. maintenance,functional
63324,Ut exercitationem dignissimos aliquam. maintenance,decommissioned
99417,Eius ratione voluptatem aliquam. maintenance,decommissioned
47840,Recusandae vel non iste doloremque architecto unde autem. maintenance,functional
34957,Tempore sunt tempora fugit modi odio molestias hic. maintenance,functional
89046,Molestiae nesciunt cum vero ab. maintenance,functional
74213,Cum illo consectetur porro autem occaecati. maintenance,functional
74151,Eum accusantium illo minus dignissimos harum illum. maintenance,functional
83239,Maiores libero corrupti nemo porro labore nam. maintenance,repair
39043,Animi placeat dicta in voluptates in ex. maintenance,decommissioned
24173,Vitae a necessitatibus explicabo neque dolore pariatur. maintenance,functional
9200,Minus autem consequatur aliquid at reprehenderit accusantium. maintenance,decommissioned
24015,Corporis molestiae blanditiis nostrum neque occaecati doloremque. maintenance,decommissioned
78871,Ullam commodi cupiditate nemo fugit itaque odit. maintenance,repair
74323,Tempore ullam numquam perspiciatis facere ullam ipsum. maintenance,decommissioned
826,Culpa beatae vero odio. maintenance,repair
78344,Architecto consequatur veniam voluptates assumenda necessitatibus. maintenance,decommissioned
74351,Asperiores eligendi minus eligendi qui nostrum nemo totam. maintenance,decommissioned
84432,Fugit deleniti suscipit eum quo ipsam. maintenance,repair
10376,Animi itaque et qui quas fuga quisquam. maintenance,decommissioned
22473,Maiores occaecati fugiat pariatur. maintenance,repair
77374,Voluptatum magni id sunt quod. maintenance,repair
45936,Atque corrupti eveniet in. maintenance,decommissioned
43587,Quod eaque tempore cupiditate. maintenance,functional
26978,Sapiente neque temporibus possimus. maintenance,decommissioned
38958,Iste quae accusamus reiciendis aut voluptatibus quasi nisi. maintenance,repair
13034,Enim quasi totam ducimus. maintenance,repair
61773,Cupiditate rerum assumenda ut. maintenance,functional
55497,Nam id quae. maintenance,repair
36839,Esse mollitia impedit. maintenance,repair
19953,Velit velit nostrum veniam magni consequatur. maintenance,functional
58543,Corporis rerum impedit veniam excepturi eveniet odio. maintenance,repair
91566,Ut esse dicta. maintenance,decommissioned
23854,Nesciunt aperiam neque cumque illo minima dolor totam. maintenance,repair
66285,Eligendi saepe facilis officiis. maintenance,decommissioned
87047,Natus autem suscipit nesciunt. maintenance,repair
34195,Repudiandae quibusdam quo quae. maintenance,functional
67394,Non quibusdam maxime corrupti earum. maintenance,decommissioned
38973,Ut dolore ab nemo harum possimus impedit dolorum. maintenance,repair
11510,Aspernatur odit tempora assumenda eos. maintenance,decommissioned
5017,Adipisci porro dolorem libero. maintenance,functional
53124,Voluptatibus iure corporis maxime pariatur eligendi quisquam. maintenance,repair
29959,Modi consequuntur consectetur exercitationem assumenda. maintenance,decommissioned
59061,Aspernatur quas voluptatum occaecati illum at. maintenance,repair
56174,Voluptates consequuntur molestias quis. maintenance,repair
57400,Esse repellendus a fugiat perferendis. maintenance,decommissioned
24281,Possimus reiciendis hic pariatur enim nulla ut tenetur. maintenance,repair
67214,Dolores odit modi fugit voluptatibus alias placeat. maintenance,decommissioned
36400,Voluptatibus inventore molestias libero. maintenance,decommissioned
60265,Asperiores sapiente vero ducimus corporis. maintenance,functional
17965,Esse facere quaerat vel. maintenance,repair
58588,Illum velit cupiditate. maintenance,decommissioned
42321,Ex asperiores magni. maintenance,functional
27893,Quisquam nostrum mollitia corporis hic. maintenance,repair
82801,Dicta quis ducimus aspernatur. maintenance,decommissioned
8611,Ea repellat atque odio aperiam. maintenance,repair
99997,Cumque laboriosam nam rem. maintenance,repair
43519,Molestiae accusantium commodi repellendus. maintenance,repair
75727,Odit explicabo suscipit saepe expedita quidem fugiat. maintenance,functional
77019,A doloribus assumenda beatae officiis totam. maintenance,repair
28130,Architecto assumenda error mollitia accusantium ipsa. maintenance,functional
44560,Exercitationem totam ipsam quod saepe excepturi minima. maintenance,functional
30046,Porro quasi qui tempore a voluptatum. maintenance,functional
79826,Asperiores quas perferendis reiciendis veniam. maintenance,functional
95687,Eius nesciunt rerum soluta repellendus ducimus ipsa iusto. maintenance,decommissioned
19871,Doloribus rerum quos veritatis eum eaque. maintenance,functional
23631,Enim vel doloribus sapiente ut error facere et. maintenance,functional
31852,Quam veritatis consequatur accusamus. maintenance,decommissioned
70376,Recusandae veritatis ullam. maintenance,repair
83032,Nisi aperiam est eum dolor exercitationem. maintenance,functional
40050,Quam fugiat reprehenderit dignissimos. maintenance,repair
12382,Doloremque consequatur similique odit molestias omnis possimus. maintenance,functional
82095,Ad dignissimos dolor dicta odit suscipit deleniti. maintenance,repair
24061,Temporibus recusandae in pariatur cumque. maintenance,repair
12480,Recusandae saepe unde alias molestias eaque corrupti. maintenance,decommissioned
24638,Facilis rem sunt ex. maintenance,repair
44747,Atque fuga provident nobis minima sit est eaque. maintenance,functional
17904,Quo quos nam beatae repudiandae. maintenance,decommissioned
77529,Veniam labore impedit non nulla. maintenance,repair
7104,Tempore quas debitis quos. maintenance,decommissioned
57082,Vero vel in. maintenance,decommissioned
12830,Harum dicta quam iure accusantium fuga. maintenance,decommissioned
59338,Aliquam maiores dolorem nostrum libero iure. maintenance,functional
31946,Officiis quam iste soluta laboriosam. maintenance,repair
9281,Quos eum repellendus. maintenance,repair
91715,Nam atque at beatae similique. maintenance,repair
73413,Voluptates eligendi veniam odio quidem corrupti saepe. maintenance,repair
65548,Impedit excepturi magnam dolorum. maintenance,repair
43174,Doloremque deserunt necessitatibus culpa blanditiis ratione. maintenance,repair
61120,Sapiente excepturi modi in unde quaerat incidunt. maintenance,repair
8379,Officia tenetur consequatur eos delectus voluptas. maintenance,decommissioned
39495,Sunt minus nemo expedita vero fugiat blanditiis. maintenance,repair
77747,Cupiditate est quam repellat impedit quod eum. maintenance,repair
20233,Eum sunt id enim. maintenance,repair
58263,Mollitia consequuntur labore vero nostrum odit voluptatem. maintenance,functional
40280,Commodi esse perspiciatis quidem. maintenance,repair
40282,Consectetur aut libero nihil. maintenance,decommissioned
33774,Doloremque unde unde. maintenance,repair
61703,Facere minus illo provident dolor earum. maintenance,functional
18387,Consequatur hic consequatur error. maintenance,functional
17297,Molestias illo odio numquam dolores. maintenance,repair
60724,Doloribus doloribus distinctio incidunt. maintenance,functional
199,Ad deserunt assumenda assumenda temporibus. maintenance,functional
93397,Dignissimos quisquam veniam ducimus id. maintenance,repair
11732,Necessitatibus sapiente tempora velit. maintenance,functional
47056,Unde aut impedit sed mollitia odio. maintenance,functional
49448,Dolorem accusamus labore sunt at id voluptatem. maintenance,functional
78398,Quam repellendus earum. maintenance,repair
99382,Ullam eveniet fugit soluta optio. maintenance,functional
65456,Modi consectetur laudantium facilis totam quae sequi deserunt. maintenance,functional
1313,Quos doloremque voluptas quam cumque eos. maintenance,functional
46978,Saepe ipsum aliquid rerum mollitia eaque. maintenance,functional
12043,Id corporis ex culpa ut ipsum. maintenance,decommissioned
79083,Adipisci ab eos consequatur non at. maintenance,repair
2125,Odio cumque dolorum minima qui unde. maintenance,repair
54458,Est laboriosam quibusdam ipsam. maintenance,repair
48481,Tempore consequuntur voluptatum aut dicta dolore rerum. maintenance,repair
5117,Voluptatum atque nostrum a asperiores itaque. maintenance,decommissioned
56581,Deleniti sequi praesentium similique ex reprehenderit. maintenance,functional
41579,Placeat hic consequatur distinctio. maintenance,decommissioned
10809,Illo quia qui soluta dolorem. maintenance,repair
2100,Vitae sit consectetur veniam optio. maintenance,decommissioned
7563,Magni veritatis sunt vel vel natus commodi. maintenance,decommissioned
28337,Aliquid ipsam modi recusandae. maintenance,decommissioned
82131,Cupiditate alias consectetur vero eaque fugit. maintenance,functional
