record_ID,Description,Status
6842,Et quod harum ipsum quam reiciendis. maintenance,repair
39097,Doloremque blanditiis dolorum explicabo animi ratione. maintenance,decommissioned
93357,Odit excepturi dolores atque sint. maintenance,repair
51508,Earum officia assumenda voluptatibus. maintenance,repair
50525,Quod nulla velit nulla. maintenance,decommissioned
39927,Iure assumenda qui eius. maintenance,functional
19393,Ut unde accusamus repellendus. maintenance,decommissioned
79883,Dolorum unde maiores corporis voluptate quod perspiciatis. maintenance,repair
59010,Facilis corporis dignissimos nesciunt perspiciatis molestias porro. maintenance,decommissioned
17087,Possimus autem nulla eaque et. maintenance,functional
24639,Et qui voluptates vitae asperiores natus odio. maintenance,repair
82152,Deleniti soluta cumque hic. maintenance,repair
58362,Distinctio ipsam dolore aut incidunt. maintenance,functional
36642,Culpa temporibus harum consequuntur rem minima illum. maintenance,repair
66716,Suscipit voluptates eos magni. maintenance,decommissioned
27466,Dignissimos porro explicabo qui impedit quod. maintenance,functional
31492,Labore voluptates commodi laudantium sit. maintenance,repair
82151,Autem expedita nemo corporis eligendi optio nostrum. maintenance,functional
83072,Exercitationem quibusdam omnis fugiat excepturi. maintenance,repair
97550,Harum omnis ullam fuga odit soluta minima. maintenance,decommissioned
37283,Reiciendis dignissimos rem nobis quisquam eum. maintenance,functional
3103,Harum dolor ipsam. maintenance,repair
91252,Distinctio numquam ullam porro quod quo. maintenance,functional
20158,Veniam architecto impedit sint totam sit. maintenance,repair
76622,Voluptate perspiciatis corporis maxime. maintenance,repair
50244,Porro nam debitis minima dolores amet possimus. maintenance,repair
38406,Voluptate eveniet nam veniam voluptatibus earum. maintenance,decommissioned
62947,Eligendi fugiat labore porro ad modi natus. maintenance,decommissioned
24190,At molestiae mollitia harum quasi tempora perferendis. maintenance,functional
26656,Fuga beatae dolorum dolorum aperiam blanditiis. maintenance,repair
6711,Mollitia molestiae voluptatum suscipit. maintenance,decommissioned
51762,Autem magni earum. maintenance,decommissioned
80101,Velit distinctio consequuntur odio cupiditate dolor. maintenance,repair
76033,Repudiandae perferendis sunt. maintenance,decommissioned
55257,Sapiente laborum quo voluptatum deserunt non maxime nostrum. maintenance,functional
10907,Nulla deleniti rerum tempore. maintenance,decommissioned
44163,Cumque labore aut repellendus aliquid dignissimos provident. maintenance,functional
8094,Deleniti ad provident ratione unde dolores. maintenance,decommissioned
95290,Similique voluptatem voluptatibus ex aliquam. maintenance,decommissioned
65190,Nisi odit maiores rem quibusdam id. maintenance,functional
72092,Sunt dignissimos culpa est sequi dolorem eum animi. maintenance,decommissioned
63169,Reiciendis vero voluptas sint nobis placeat voluptate. maintenance,functional
701,Aut ullam similique molestiae error illum at. maintenance,repair
14075,Hic officiis dolores expedita beatae iste placeat. maintenance,decommissioned
56937,Ipsum maxime nesciunt nisi. maintenance,decommissioned
10606,Illum ad consectetur ex. maintenance,functional
63652,Eligendi dolores in optio. maintenance,repair
38617,Maiores quis doloremque consequuntur eos laudantium. maintenance,decommissioned
40325,Blanditiis sunt maxime corporis provident. maintenance,repair
95756,Doloremque ipsam maxime repudiandae a modi error. maintenance,repair
11427,Illum quae consequatur inventore totam rem rerum. maintenance,functional
18857,Reprehenderit tempore debitis voluptatibus. maintenance,decommissioned
78118,Sit nemo suscipit cupiditate nulla dolor. maintenance,repair
34609,Asperiores culpa consequatur eum debitis. maintenance,decommissioned
59324,Cumque eaque cupiditate. maintenance,repair
4577,Dicta fugit ipsum fugiat optio provident. maintenance,functional
12424,Neque laboriosam reprehenderit voluptas. maintenance,decommissioned
17827,Dolores soluta fuga corrupti illo veniam. maintenance,repair
98038,Deleniti porro fugiat voluptate esse facilis. maintenance,repair
22695,Nobis harum amet excepturi dolorum totam. maintenance,repair
18392,Repellendus laborum alias esse ratione voluptas nostrum animi. maintenance,functional
38009,Laborum autem quos odio dignissimos quasi itaque. maintenance,functional
26051,Repellat perspiciatis quae nobis sit culpa laudantium. maintenance,decommissioned
90312,Adipisci veniam nesciunt. maintenance,repair
3918,Quibusdam omnis maiores et. maintenance,functional
66165,Fugit sint tempora saepe. maintenance,functional
2146,Aut corporis totam corporis asperiores. maintenance,functional
83727,Placeat deleniti quisquam adipisci voluptatem. maintenance,decommissioned
67633,Quae rem voluptates est necessitatibus saepe. maintenance,decommissioned
37416,Voluptatem dicta magnam ratione. maintenance,functional
62878,Voluptates fuga rem nihil soluta. maintenance,decommissioned
46294,Praesentium nisi ea dicta. maintenance,repair
14199,Perspiciatis praesentium eius voluptatibus excepturi cumque excepturi. maintenance,decommissioned
70423,Illum ullam fuga dignissimos eius voluptas. maintenance,decommissioned
856,Dolor tenetur eos ullam corrupti atque quia. maintenance,decommissioned
33396,A eveniet odit ipsum nulla magnam aliquam. maintenance,repair
87753,Illo voluptate inventore temporibus ab unde provident suscipit. maintenance,functional
20365,Veniam libero reiciendis ullam autem sapiente iste. maintenance,functional
57013,Delectus molestiae quibusdam aliquam id nulla asperiores itaque. maintenance,repair
93306,Asperiores assumenda quidem provident. maintenance,decommissioned
84650,Dicta sit consequatur eos quod voluptatem voluptates. maintenance,decommissioned
15464,Officia odit labore magnam ipsam. maintenance,decommissioned
43641,Voluptate porro commodi dolore odio fuga. maintenance,functional
19917,Deleniti veritatis sapiente libero minus velit incidunt. maintenance,decommissioned
29303,Harum amet quae non incidunt optio. maintenance,repair
22637,Vero veritatis voluptas ipsam quas magni. maintenance,repair
23721,Iure molestiae occaecati assumenda et. maintenance,decommissioned
57963,Voluptas omnis tempore error libero reiciendis. maintenance,repair
82786,Molestiae tempore alias temporibus. maintenance,decommissioned
88623,Animi nisi doloribus ex molestiae non. maintenance,functional
19096,Enim doloremque voluptate laborum rerum ipsum. maintenance,repair
85492,Sit excepturi at est molestiae dolorum architecto iusto. maintenance,functional
86123,Libero nobis odio rerum error maxime placeat. maintenance,decommissioned
45842,Omnis quis facere soluta. maintenance,decommissioned
63864,Voluptas dicta eaque modi numquam blanditiis. maintenance,decommissioned
13639,Ex laudantium repudiandae delectus aperiam culpa impedit. maintenance,repair
2436,Voluptatum inventore ratione qui non. maintenance,repair
3913,Ad eaque doloribus veniam consequuntur. maintenance,decommissioned
88857,Labore ratione est pariatur amet libero perspiciatis eius. maintenance,functional
84664,Maxime fugit sunt sint. maintenance,decommissioned
53898,Voluptatum nihil consequuntur sapiente facilis. maintenance,functional
6912,Exercitationem quod soluta beatae. maintenance,repair
97774,Ea ipsam deserunt suscipit vitae temporibus. maintenance,functional
52899,Occaecati iusto voluptatum eaque. maintenance,decommissioned
13025,Similique officiis iure. maintenance,functional
95790,Vero voluptate temporibus harum necessitatibus excepturi sint veniam. maintenance,functional
37418,Voluptatibus similique asperiores. maintenance,repair
67826,A cupiditate repellat ut soluta veniam assumenda. maintenance,repair
74016,Deserunt velit ratione dolore omnis ratione quidem eaque. maintenance,repair
55070,Voluptatum iste dolorum perspiciatis quaerat architecto quis dolor. maintenance,functional
25675,Excepturi sed dolorem perspiciatis id numquam iusto quo. maintenance,repair
1002,Praesentium fugiat pariatur consequatur eos dolorum distinctio. maintenance,functional
76167,Qui laborum inventore nemo vero nostrum. maintenance,repair
17323,Nostrum consequatur iure necessitatibus vitae tenetur blanditiis. maintenance,decommissioned
47915,Error nam earum dolorum natus quaerat. maintenance,decommissioned
31062,Corrupti aperiam hic ratione. maintenance,functional
39516,Dolorem quia sit amet autem. maintenance,decommissioned
13983,Molestias magni ratione ullam debitis odio molestiae voluptatum. maintenance,functional
5367,Vero impedit eveniet neque. maintenance,repair
86650,Numquam accusamus repellat doloribus culpa dolore eligendi. maintenance,functional
69398,Ipsa tempore quam odit maiores dolores. maintenance,decommissioned
61011,Adipisci qui illo voluptas reprehenderit quod. maintenance,functional
19283,Quis autem error soluta fugit. maintenance,decommissioned
31133,Delectus velit deserunt cumque laboriosam. maintenance,functional
2175,Facere atque debitis labore et ipsum consequuntur voluptates. maintenance,functional
98991,Ex fugit quasi officia. maintenance,functional
5922,Consequuntur at nobis veniam rerum deserunt eos. maintenance,decommissioned
90025,Maxime in veniam mollitia molestias nesciunt. maintenance,repair
83523,Beatae in voluptates in dolor voluptas nulla. maintenance,repair
84883,Placeat quia totam repellat. maintenance,functional
49226,Blanditiis beatae ullam nemo magnam eius. maintenance,repair
8782,Voluptatum quidem libero modi. maintenance,decommissioned
75833,Assumenda ea explicabo deserunt a. maintenance,decommissioned
22894,Fuga voluptas ipsa expedita. maintenance,functional
82271,Vero soluta atque quod enim perferendis. maintenance,repair
95012,Mollitia fugiat eligendi iste error tempora. maintenance,functional
88838,Doloremque cum quo soluta animi aliquid. maintenance,repair
97054,Numquam iure cum esse quis delectus optio. maintenance,decommissioned
48430,Quasi molestiae praesentium molestias nemo modi necessitatibus. maintenance,repair
7664,Aspernatur sequi quos suscipit reprehenderit reiciendis. maintenance,repair
85919,Voluptate ex ipsam voluptatem. maintenance,decommissioned
36771,Unde adipisci excepturi nemo nulla eum. maintenance,functional
86026,Error a quia reprehenderit perferendis nisi. maintenance,decommissioned
24629,Voluptatem tempore eum ducimus. maintenance,functional
18445,Nobis doloremque quas doloribus cum rerum. maintenance,repair
67381,Veniam accusamus magnam vitae. maintenance,functional
45926,Illo fugit dolor eligendi esse unde voluptatem. maintenance,repair
24888,Repudiandae ea tempore at doloremque. maintenance,functional
79995,Corporis sed quisquam rerum ipsum fugiat repellendus fugiat. maintenance,decommissioned
35389,Velit facilis quia maxime aut repudiandae. maintenance,functional
12176,Tenetur fugiat labore. maintenance,decommissioned
50700,Ad minima doloribus dolor quo minima rerum. maintenance,repair
96138,Voluptate tempora autem vitae. maintenance,repair
8367,Error ipsa eius provident tempore deleniti soluta rem. maintenance,decommissioned
16192,Beatae fugit incidunt rerum. maintenance,functional
80354,Quas porro porro laborum error sunt. maintenance,functional
37699,Adipisci voluptatibus iste iure dicta. maintenance,repair
80892,Quod porro vel cupiditate. maintenance,decommissioned
61604,Doloremque maxime quae nam dolorum eos. maintenance,decommissioned
14698,Tempore quam incidunt quidem fugit. maintenance,repair
599,Nisi vitae recusandae beatae hic placeat modi. maintenance,decommissioned
11737,Aut alias consequatur rem laboriosam iure libero. maintenance,decommissioned
36977,Itaque totam optio nam. maintenance,decommissioned
27491,Iure fuga praesentium voluptatibus. maintenance,decommissioned
86636,Saepe nostrum eligendi vel quisquam. maintenance,decommissioned
34240,Recusandae eaque sint illo tempora eius beatae amet. maintenance,decommissioned
89857,Sint voluptas dolorum nam illum quos pariatur. maintenance,repair
75126,Id aliquam illum id voluptates cupiditate laudantium. maintenance,decommissioned
34173,Asperiores quaerat voluptatibus quae. maintenance,functional
6521,Explicabo voluptate voluptates voluptatum vero ipsum alias. maintenance,functional
74546,Ut officia odio incidunt quibusdam consectetur facilis nostrum. maintenance,repair
46121,Eius id exercitationem mollitia harum. maintenance,functional
60081,Nemo sed qui unde. maintenance,repair
65338,Voluptates at placeat voluptates. maintenance,repair
97103,Distinctio deleniti rem beatae maxime adipisci enim repellendus. maintenance,decommissioned
99649,Perspiciatis eum eum ipsam quam. maintenance,functional
94058,Harum laborum id mollitia. maintenance,decommissioned
95735,Culpa quod incidunt in excepturi quia sapiente. maintenance,functional
78797,Cum atque enim magni hic alias. maintenance,repair
88585,Repudiandae harum neque ab repellat nesciunt. maintenance,decommissioned
46897,Impedit deleniti hic distinctio odit unde. maintenance,functional
25643,Consectetur itaque cumque dicta quae eum temporibus. maintenance,functional
56685,Nemo nulla minus eum ratione atque voluptas. maintenance,repair
19857,Reiciendis ipsa amet impedit tenetur est doloribus. maintenance,functional
30860,Ea ab minus dolores veritatis veritatis vitae. maintenance,decommissioned
19322,Velit necessitatibus similique consequatur vero. maintenance,repair
13489,Perferendis culpa fugit a omnis. maintenance,repair
68823,Quia ipsum aperiam incidunt vero reiciendis. maintenance,decommissioned
92977,Sit maxime molestias quam ab. maintenance,repair
37057,Porro dolores in rem. maintenance,decommissioned
99104,Earum nesciunt excepturi natus nostrum eos laudantium. maintenance,functional
86400,Totam sapiente ad perspiciatis rerum nulla illum quo. maintenance,functional
99505,Dolor animi ullam vero aspernatur repudiandae. maintenance,repair
22096,Reprehenderit expedita nostrum nesciunt odio. maintenance,decommissioned
85641,Distinctio asperiores dolores. maintenance,functional
43578,Optio doloremque ea alias sint perferendis. maintenance,repair
47380,Rem exercitationem veniam ullam vel omnis qui. maintenance,repair
59891,Distinctio adipisci ad minima nisi. maintenance,decommissioned
87095,Velit iste non laborum. maintenance,repair
15640,Officia adipisci reprehenderit quas quis veritatis. maintenance,functional
77771,Temporibus est omnis minima. maintenance,repair
62454,Non cum quaerat vel cumque. maintenance,repair
56967,Vitae tenetur impedit distinctio pariatur quaerat odit. maintenance,decommissioned
42404,Illo libero iste ipsam culpa quibusdam. maintenance,functional
21813,Tempora omnis quis debitis quaerat quia officia. maintenance,repair
79848,Voluptatum vero repudiandae facere ex rerum. maintenance,functional
904,Magnam architecto neque explicabo excepturi enim. maintenance,functional
42301,Accusamus sequi itaque quia laboriosam. maintenance,functional
5515,Ullam ipsam quibusdam iusto quod corporis repudiandae. maintenance,repair
11053,Inventore totam aut. maintenance,functional
8583,Harum nisi illum quae ratione. maintenance,functional
40721,Suscipit saepe consectetur doloremque esse culpa pariatur fugit. maintenance,repair
69186,Rem doloremque nobis magni. maintenance,decommissioned
13033,Laboriosam quas est. maintenance,repair
45218,Dolorum reiciendis deleniti adipisci error. maintenance,functional
87842,Temporibus dolorem aspernatur doloremque pariatur nesciunt. maintenance,decommissioned
58692,Unde commodi minus ducimus. maintenance,functional
10192,Qui id necessitatibus provident expedita. maintenance,functional
41862,Voluptatum omnis sed exercitationem sed ad nesciunt. maintenance,functional
90950,Repellat ex voluptates dolorem non dolorum. maintenance,functional
66183,Commodi officiis nulla nam nam ipsam aliquid recusandae. maintenance,functional
44093,Enim quasi aperiam explicabo facilis. maintenance,functional
87632,Architecto nobis totam cum. maintenance,decommissioned
88848,Voluptates reprehenderit quos voluptatum placeat animi ullam. maintenance,functional
97565,Consequatur nulla cum facilis. maintenance,repair
45013,Ullam tempore laborum labore mollitia. maintenance,repair
58835,Aperiam laboriosam numquam qui recusandae deserunt. maintenance,decommissioned
21240,Blanditiis eius voluptates iure. maintenance,decommissioned
13295,Fugit nobis aperiam quos repellat nesciunt doloribus iusto. maintenance,functional
93640,Voluptate sit quam reprehenderit velit. maintenance,repair
21693,Enim eligendi doloribus. maintenance,repair
8524,Vero temporibus illo cumque impedit illum alias. maintenance,repair
99816,Suscipit eveniet culpa necessitatibus facere beatae eius. maintenance,decommissioned
45899,Cupiditate voluptatum cum fugiat voluptates. maintenance,functional
61317,Reiciendis ad architecto quidem error labore velit facere. maintenance,functional
21088,Blanditiis facere quas ea officia. maintenance,repair
12469,Placeat dolor at consequatur eligendi soluta. maintenance,functional
29381,Non reprehenderit omnis aut eius modi optio non. maintenance,repair
31899,Harum laudantium rem suscipit voluptatem. maintenance,repair
1119,Deleniti non dolore rem voluptatum. maintenance,decommissioned
22529,Molestiae excepturi nulla temporibus accusamus fuga eveniet. maintenance,repair
95816,Rem dolorem pariatur animi consequuntur corrupti. maintenance,repair
73277,Porro ex ut ullam excepturi itaque. maintenance,decommissioned
42030,Harum accusantium nulla. maintenance,repair
32705,Laborum cumque libero esse assumenda. maintenance,decommissioned
69198,Accusantium quas cum. maintenance,decommissioned
6880,Ea dolorem saepe. maintenance,decommissioned
72484,Asperiores eos eaque soluta. maintenance,decommissioned
92782,Culpa similique dolor rem labore natus. maintenance,repair
37016,Illo repellendus ratione dicta. maintenance,repair
26005,Quaerat suscipit saepe itaque porro veritatis saepe. maintenance,functional
47594,Et eum cumque culpa voluptates. maintenance,repair
49436,Temporibus dolorem consectetur quasi iste. maintenance,repair
79618,Tempora saepe quibusdam. maintenance,functional
31472,Sed id architecto nulla facere. maintenance,repair
57970,Adipisci quos quasi porro labore eveniet. maintenance,repair
48526,Eligendi quod modi doloremque. maintenance,decommissioned
11266,Debitis voluptatum rerum esse harum eaque nesciunt. maintenance,repair
95883,Itaque ex minus quis. maintenance,functional
26569,Cum amet molestiae quo nihil voluptate id. maintenance,repair
18092,Sit consequuntur doloribus. maintenance,decommissioned
47659,Perspiciatis quis veniam sit blanditiis. maintenance,decommissioned
3616,Voluptates similique at quidem voluptas voluptates. maintenance,functional
19674,Vitae alias cum tempora veniam eveniet quae. maintenance,decommissioned
65169,Cum porro consequuntur. maintenance,functional
90142,Ratione hic sunt repellat aperiam expedita distinctio. maintenance,functional
76018,Quasi quibusdam quis accusamus molestiae ab. maintenance,decommissioned
42122,Consectetur vitae itaque itaque. maintenance,repair
96925,Autem eos cumque quo. maintenance,repair
2930,Omnis mollitia blanditiis enim unde facere. maintenance,functional
20982,Pariatur et consectetur cupiditate. maintenance,functional
43771,Beatae nostrum est dicta tempora neque. maintenance,repair
84695,Impedit atque voluptate. maintenance,repair
46947,Voluptatibus temporibus asperiores fuga. maintenance,repair
4852,Asperiores occaecati perspiciatis eaque commodi. maintenance,functional
1322,Explicabo dolore quia non quod aperiam. maintenance,functional
42033,Consectetur quibusdam odio excepturi commodi laboriosam aliquam consequuntur. maintenance,decommissioned
78755,Magnam rem quisquam id iusto. maintenance,repair
18013,Delectus vitae numquam eaque earum vel cumque. maintenance,decommissioned
98143,Blanditiis dignissimos maiores ipsa. maintenance,decommissioned
2954,Hic molestias harum dolore dolorem labore doloremque. maintenance,functional
1157,Consequuntur repellendus illo rem. maintenance,repair
31863,Impedit autem sit cumque impedit pariatur ab mollitia. maintenance,repair
99753,Similique vitae porro in sunt. maintenance,functional
49052,Quia tenetur repudiandae error necessitatibus ex error soluta. maintenance,repair
52877,Rem ipsa doloremque deleniti distinctio consequuntur. maintenance,functional
28029,Nobis numquam necessitatibus dolorum impedit iste libero. maintenance,decommissioned
76499,Modi similique eos error alias. maintenance,decommissioned
28467,Nostrum unde earum fugit. maintenance,functional
21772,Culpa cupiditate quaerat expedita. maintenance,functional
64304,Tempore autem modi voluptatem magnam maxime. maintenance,functional
44109,Sint tempore eveniet molestias aperiam ratione animi tempore. maintenance,decommissioned
96091,Dolorum aspernatur sequi nesciunt voluptates tempora. maintenance,repair
65047,Vero vitae at et nihil. maintenance,decommissioned
44482,Qui repellendus nam illum. maintenance,decommissioned
12049,Nisi hic animi debitis maxime aspernatur odit. maintenance,decommissioned
96118,Provident doloremque non cumque distinctio velit. maintenance,repair
40144,Rem distinctio maiores vitae. maintenance,decommissioned
3992,Corrupti tempora sint ea fuga saepe. maintenance,functional
52237,Praesentium ea iste odio alias. maintenance,decommissioned
62619,Sequi ab esse. maintenance,functional
32174,Consequatur accusantium recusandae consequatur nesciunt. maintenance,repair
51565,Quisquam accusantium incidunt culpa dicta at saepe. maintenance,decommissioned
63894,Ad possimus sunt iste. maintenance,repair
28027,Magnam fugit perferendis. maintenance,functional
4280,Voluptatum culpa doloribus debitis. maintenance,functional
89767,Enim dolorem ut excepturi ipsam facilis hic. maintenance,repair
24713,Quibusdam qui labore tempore quod quis voluptates. maintenance,repair
64508,Atque maxime error quisquam esse perspiciatis. maintenance,functional
18633,Officiis quis excepturi asperiores tenetur unde. maintenance,repair
37012,Eum qui tenetur sit optio ipsam. maintenance,decommissioned
17926,Inventore voluptate officia quia corrupti necessitatibus. maintenance,functional
96932,Praesentium exercitationem earum delectus. maintenance,functional
8128,Facere accusantium magnam natus corrupti quos voluptas. maintenance,decommissioned
64922,Sunt tempore aperiam nostrum ex quia nihil. maintenance,decommissioned
75763,Exercitationem blanditiis doloremque harum vero. maintenance,functional
65313,Voluptatem voluptatem expedita perspiciatis. maintenance,repair
3359,Totam temporibus nobis iure. maintenance,functional
73697,Sit saepe officiis impedit maxime quam. maintenance,decommissioned
17600,Magni reprehenderit quasi repellat. maintenance,functional
77676,A accusantium ut ipsam dignissimos. maintenance,decommissioned
79239,Ullam quae eius hic magni minima non. maintenance,repair
10483,Repudiandae animi libero ad. maintenance,decommissioned
32296,Delectus eveniet quo error architecto enim repudiandae. maintenance,repair
83792,Optio animi officiis earum eum amet asperiores. maintenance,repair
98308,Animi perferendis autem eum non voluptatum totam porro. maintenance,repair
29921,Eveniet praesentium ipsum cupiditate. maintenance,repair
89796,Nobis blanditiis doloremque asperiores. maintenance,decommissioned
58701,Fugit omnis commodi assumenda temporibus. maintenance,repair
94518,Amet modi unde distinctio veritatis nesciunt vero. maintenance,decommissioned
9945,Id corporis soluta tempore facere. maintenance,decommissioned
8813,Cupiditate repellat quos aperiam. maintenance,functional
13303,Impedit neque exercitationem tempore non modi. maintenance,repair
27390,Soluta veniam cupiditate sint. maintenance,repair
53747,Quis enim eius eveniet minima libero in. maintenance,decommissioned
7210,Harum magni quam deserunt laborum officia. maintenance,decommissioned
84903,Reprehenderit porro optio doloremque illum ipsum repudiandae. maintenance,decommissioned
34530,Ab autem animi. maintenance,decommissioned
95688,Nisi sapiente sint fugiat beatae maiores perspiciatis. maintenance,decommissioned
47243,Illo voluptates ducimus dolorem veritatis nisi. maintenance,functional
24377,Cumque ad deserunt distinctio ex consequuntur porro ipsum. maintenance,decommissioned
41256,Eum similique dolores incidunt odio at quas laudantium. maintenance,decommissioned
49167,Dicta maxime minima voluptates dolorem sequi dolores. maintenance,functional
64097,Aperiam vero veniam possimus repellat recusandae. maintenance,functional
60361,Ad neque iusto quos vel aperiam. maintenance,functional
8598,Eveniet corrupti modi officiis velit odit nobis nulla. maintenance,decommissioned
69481,Perspiciatis officiis aliquam dicta labore. maintenance,functional
702,Maiores illo excepturi quasi dolores a. maintenance,decommissioned
89678,Ea doloremque accusantium vitae non facilis. maintenance,decommissioned
63202,Ea rerum maxime atque necessitatibus minima provident. maintenance,decommissioned
19799,Ad corrupti blanditiis ab. maintenance,decommissioned
93121,Dignissimos a sapiente cumque. maintenance,functional
31660,Voluptatibus eaque sapiente qui aliquam facilis optio. maintenance,functional
21070,Magnam recusandae ex est. maintenance,decommissioned
75257,Rem doloribus expedita repellat nulla animi. maintenance,repair
20757,Iusto repellendus quo amet occaecati numquam delectus quo. maintenance,functional
95310,Aut maiores quos distinctio. maintenance,functional
71336,Quas sint delectus repudiandae asperiores facere quae ex. maintenance,decommissioned
84224,Ad at eum aut veniam sint unde. maintenance,decommissioned
46684,Vero consequatur ipsa explicabo ullam. maintenance,repair
25058,Fugiat officiis minus debitis hic quia beatae. maintenance,decommissioned
27009,Alias modi corporis rerum omnis. maintenance,decommissioned
77000,Est a eius alias. maintenance,repair
49481,Itaque reiciendis optio minima eos beatae. maintenance,functional
