record_ID,Description,Status
31632,Sequi natus dolorem nisi laudantium. maintenance,functional
68343,Cumque sequi esse debitis. maintenance,repair
24807,Laboriosam sunt occaecati quas velit. maintenance,functional
40686,Dolor eligendi aliquid quod tenetur ad excepturi. maintenance,repair
20312,Ipsum qui ea architecto. maintenance,functional
70681,Iure nesciunt provident sint quod sed provident. maintenance,repair
67164,Quam ipsa incidunt iure ad odio corrupti. maintenance,repair
48872,Ratione rem porro quos dolorem omnis. maintenance,decommissioned
60551,Voluptate molestiae dolorem tempora quo. maintenance,decommissioned
94989,Assumenda harum alias laboriosam cupiditate consequuntur quam. maintenance,repair
28392,Recusandae voluptates atque occaecati a sit libero. maintenance,functional
70936,Quibusdam at sequi. maintenance,functional
54413,Distinctio repudiandae dolor nostrum atque iusto soluta unde. maintenance,repair
68727,Necessitatibus officia at itaque saepe mollitia. maintenance,functional
55903,Culpa a vel expedita occaecati itaque sed. maintenance,repair
20061,Numquam quas expedita sint ipsum. maintenance,decommissioned
77349,Quia minima provident reprehenderit pariatur aliquam. maintenance,decommissioned
35812,Sed sapiente quod autem. maintenance,decommissioned
20348,Non saepe atque quis. maintenance,functional
64265,Cum numquam dolore tempore. maintenance,repair
19568,Dolor nihil aperiam voluptates. maintenance,repair
69425,Ipsam hic consequuntur illo sunt odit. maintenance,functional
80580,A voluptatum numquam officiis ducimus quo quo commodi. maintenance,decommissioned
29609,Nihil eaque et a. maintenance,repair
54574,Alias accusamus libero architecto harum unde possimus totam. maintenance,repair
29920,Architecto ratione in tempore aliquam iure. maintenance,repair
82171,Vero corporis vero recusandae modi numquam. maintenance,repair
15769,Explicabo est numquam ducimus dicta eligendi. maintenance,decommissioned
250,Laborum dolores provident dolorem ipsum provident. maintenance,repair
87962,Magnam saepe necessitatibus nihil consequatur. maintenance,repair
66615,Earum consequuntur voluptatibus tempora dolorum accusamus optio modi. maintenance,repair
13550,Magni numquam cupiditate accusamus laudantium nesciunt. maintenance,functional
1884,Error corporis quisquam nemo iste repudiandae. maintenance,decommissioned
95930,Voluptatem beatae incidunt nisi dolore laborum. maintenance,repair
45229,Labore dolorum magnam. maintenance,functional
96959,Perferendis reiciendis iste sapiente dicta error. maintenance,decommissioned
83029,Maxime ea nisi quidem blanditiis impedit id. maintenance,functional
87499,Quia ad impedit consequuntur amet. maintenance,functional
9344,Soluta repellat voluptatum reprehenderit assumenda. maintenance,decommissioned
27889,Assumenda harum officiis suscipit vel. maintenance,functional
15700,Eos dolorem a earum voluptas repellendus. maintenance,functional
80545,Error error maxime esse in. maintenance,functional
59875,Ullam delectus quis quas odio. maintenance,decommissioned
60848,Nesciunt omnis sapiente. maintenance,functional
32967,Aspernatur iusto minus commodi assumenda itaque. maintenance,decommissioned
56275,Fugit numquam illo error eos aliquid molestias. maintenance,decommissioned
43792,Natus natus odit totam. maintenance,decommissioned
50147,Maxime delectus aliquam porro. maintenance,repair
123,Voluptates esse illum adipisci excepturi harum eos quia. maintenance,functional
83891,Dolore impedit excepturi in delectus distinctio. maintenance,repair
39836,Dolorem voluptates harum eligendi sint qui aliquam. maintenance,functional
26098,Nemo perferendis reprehenderit beatae quos totam praesentium. maintenance,repair
68621,Animi corporis magnam minus ratione. maintenance,decommissioned
14061,Assumenda sequi nostrum deleniti sequi. maintenance,repair
28223,Porro dolores tenetur dolorem inventore nobis cum quo. maintenance,decommissioned
55829,Autem officia quo nisi. maintenance,repair
23553,Aut ut tenetur enim ipsa voluptatem. maintenance,repair
33765,Omnis placeat maxime nam. maintenance,repair
21855,Atque deserunt distinctio nemo nemo nulla. maintenance,functional
57540,Vel veritatis officiis blanditiis ab asperiores nesciunt. maintenance,repair
22186,Voluptatem ipsam odit nisi ab harum excepturi non. maintenance,decommissioned
84447,Occaecati tenetur perferendis debitis. maintenance,functional
82031,Explicabo dolore deserunt perferendis a vitae incidunt recusandae. maintenance,decommissioned
79807,Neque fugiat eum officiis. maintenance,functional
96246,Recusandae rerum minus dicta consequatur asperiores omnis. maintenance,repair
53338,Perferendis sed autem deserunt laborum. maintenance,repair
77521,Sit quasi incidunt rerum inventore. maintenance,functional
91548,Et facilis est omnis temporibus aliquam odio. maintenance,decommissioned
50241,Veritatis a doloremque. maintenance,functional
81855,Accusamus minima sunt doloribus laboriosam unde mollitia. maintenance,decommissioned
89414,Facilis repudiandae tenetur ratione. maintenance,repair
28174,Ut eius quod ut quia harum magnam nihil. maintenance,decommissioned
54704,Et dolor tempore ipsum excepturi. maintenance,repair
13868,Sunt laborum saepe sunt eum. maintenance,repair
71755,Explicabo id nostrum ex amet earum consectetur. maintenance,decommissioned
43431,Repudiandae maiores cumque incidunt commodi ipsam hic. maintenance,repair
7088,Ipsum nostrum natus ab dolor. maintenance,functional
68247,Aperiam maiores ullam corporis. maintenance,repair
31907,Esse laborum quasi odit iusto similique debitis. maintenance,repair
37348,Vero architecto accusantium. maintenance,functional
31461,Voluptatem pariatur pariatur repellat quae officia. maintenance,functional
62304,Cum quod cum nostrum illum tenetur. maintenance,decommissioned
92654,Dolor illo doloribus sapiente voluptates distinctio earum. maintenance,functional
85874,A atque officiis minima recusandae eaque omnis tenetur. maintenance,repair
80314,Labore rerum exercitationem blanditiis quibusdam veniam iure. maintenance,decommissioned
82465,Facere voluptatem adipisci. maintenance,functional
95287,Officiis labore quisquam commodi id. maintenance,repair
86654,Laboriosam laboriosam reiciendis ab blanditiis. maintenance,repair
16090,Commodi dolorum soluta maxime blanditiis. maintenance,decommissioned
59444,Inventore atque quam dolorum voluptatibus eos. maintenance,functional
25125,Id autem a laborum. maintenance,functional
53924,Cumque veritatis error itaque culpa sint. maintenance,functional
9406,Maxime delectus esse. maintenance,repair
39124,Error expedita expedita tempore voluptatum. maintenance,decommissioned
84417,Nobis eius omnis quod nobis ad. maintenance,decommissioned
6941,Dolor dignissimos molestiae ex. maintenance,functional
2888,Corrupti perferendis totam placeat. maintenance,repair
6377,Minus ratione dolor aliquam. maintenance,repair
57182,Vitae veritatis corrupti a voluptatum hic iste mollitia. maintenance,repair
22743,Sed nesciunt adipisci nulla neque laborum quasi consectetur. maintenance,functional
25825,Qui dolore in. maintenance,decommissioned
27626,Architecto voluptatem neque. maintenance,repair
96494,Ea distinctio est sapiente magni. maintenance,functional
46741,Doloribus ducimus officiis voluptatem. maintenance,functional
9025,Laborum impedit deleniti magni earum ullam. maintenance,functional
53529,Velit cupiditate quos debitis. maintenance,repair
9952,Corporis reprehenderit qui similique. maintenance,functional
23213,Placeat maxime natus perferendis. maintenance,repair
60842,Perferendis officiis optio. maintenance,repair
71700,Totam consectetur aperiam omnis. maintenance,decommissioned
15664,Illo voluptas ducimus vitae adipisci. maintenance,repair
29784,Molestiae dolor neque perferendis rerum eos placeat. maintenance,functional
32543,Similique voluptatibus eligendi. maintenance,repair
66155,Aliquid nam neque ea labore. maintenance,decommissioned
63174,At inventore est quos. maintenance,functional
52544,Soluta voluptates eum dolor. maintenance,decommissioned
52792,Voluptatum optio aut saepe. maintenance,decommissioned
36088,Iure earum sed laborum. maintenance,decommissioned
21433,Eum a eius quo. maintenance,repair
48415,Totam eos placeat iure in explicabo odio. maintenance,repair
13008,Est voluptas expedita beatae nemo officiis recusandae ullam. maintenance,decommissioned
66841,Consequatur nulla labore cupiditate aperiam. maintenance,repair
62834,Doloribus error vero delectus explicabo. maintenance,repair
2089,Maxime excepturi assumenda. maintenance,functional
4944,Vero perferendis natus. maintenance,functional
26920,Ullam laudantium dignissimos autem debitis error. maintenance,repair
96004,Vel occaecati eaque ea nihil saepe. maintenance,decommissioned
41420,Ipsa sint laboriosam maxime ducimus aliquid molestiae dicta. maintenance,functional
46487,Ipsum suscipit vero unde dicta odio quibusdam ipsum. maintenance,decommissioned
25601,Laboriosam expedita neque iste. maintenance,repair
19108,Itaque accusamus dignissimos architecto. maintenance,functional
35690,Laboriosam sint porro dolor. maintenance,functional
46962,Alias omnis maiores cupiditate eum. maintenance,functional
44288,Deleniti dolorum a animi possimus consectetur porro. maintenance,repair
5743,Molestiae dolore eveniet iure deleniti cumque. maintenance,functional
54725,Ut fugit esse ea. maintenance,decommissioned
75664,Voluptas quos vel voluptatibus neque doloribus. maintenance,decommissioned
77429,Cumque maiores optio eaque. maintenance,functional
75471,Rem voluptates accusamus eligendi. maintenance,functional
98031,Reiciendis recusandae optio eos asperiores nobis. maintenance,functional
77255,Atque non distinctio dolor vel. maintenance,functional
23793,Neque impedit non cupiditate ex eius. maintenance,repair
61093,Dolorum nesciunt veritatis aliquid earum hic. maintenance,repair
76333,Sed voluptate sequi fugiat. maintenance,functional
13747,Ducimus eveniet quaerat fugit harum. maintenance,functional
54915,Ad omnis facere ipsam. maintenance,decommissioned
4340,Provident nam alias reprehenderit quia. maintenance,functional
16795,Voluptatibus consequatur asperiores possimus. maintenance,decommissioned
97502,Labore quia eum occaecati veritatis rerum. maintenance,decommissioned
89591,Atque dicta a error fugiat vitae quasi nihil. maintenance,functional
1451,Optio a illo quam. maintenance,decommissioned
25583,Repellat ratione quisquam natus libero optio. maintenance,decommissioned
48514,Sint eos velit harum praesentium sequi eligendi molestias. maintenance,repair
94286,Perspiciatis eos dicta officia quos debitis. maintenance,functional
3254,Consequuntur quam fugit nobis optio ipsum animi. maintenance,decommissioned
3768,Ad non mollitia id sapiente. maintenance,functional
13901,Laboriosam aliquam fuga. maintenance,functional
55770,Tempora sapiente quod nostrum quis cupiditate in. maintenance,functional
78151,Dolores reiciendis unde mollitia veritatis consequatur occaecati. maintenance,functional
68213,Eum natus dolorem. maintenance,decommissioned
49716,Inventore itaque consequatur corporis hic. maintenance,repair
58581,Ex tenetur reiciendis tempora occaecati. maintenance,functional
85178,Doloribus ullam excepturi pariatur laboriosam. maintenance,decommissioned
31096,Odio mollitia esse excepturi rerum. maintenance,repair
15632,Saepe quibusdam adipisci distinctio mollitia impedit fuga quas. maintenance,repair
86255,Quo veniam dolores aliquid saepe dolor reiciendis iste. maintenance,repair
35531,Laborum quasi alias porro. maintenance,repair
16737,Esse sint voluptatum aperiam dolorem cupiditate. maintenance,repair
29177,Minus atque perspiciatis error labore ipsa. maintenance,repair
63133,Aliquid facere illum. maintenance,functional
48677,Numquam voluptatem molestiae necessitatibus nihil temporibus id facilis. maintenance,decommissioned
76021,Laudantium fugit ipsum aliquid temporibus fugit blanditiis. maintenance,decommissioned
34220,In esse praesentium. maintenance,repair
3817,Exercitationem alias quisquam quidem debitis. maintenance,functional
93342,Alias nostrum modi temporibus animi illo exercitationem iure. maintenance,repair
12925,Error corrupti amet delectus libero. maintenance,decommissioned
23392,Accusantium exercitationem exercitationem alias aliquid magnam molestiae. maintenance,decommissioned
36953,Delectus amet consequuntur accusamus delectus fuga. maintenance,decommissioned
31055,Repudiandae corporis sunt magnam a iure repudiandae. maintenance,decommissioned
35714,Labore accusamus saepe perspiciatis. maintenance,repair
56833,Corporis hic ab pariatur ipsam. maintenance,functional
68909,Culpa veniam neque fugiat quam veniam blanditiis. maintenance,decommissioned
47343,Voluptatem perferendis velit iusto. maintenance,functional
98844,Vitae adipisci laudantium eligendi nulla accusamus minima. maintenance,decommissioned
78396,Inventore consequatur excepturi repellat qui tempora libero. maintenance,functional
39917,Animi quas eligendi necessitatibus error sit sequi. maintenance,functional
28098,Consequatur quidem quisquam iste aperiam consequatur harum. maintenance,repair
30509,Est dolorem voluptate optio. maintenance,functional
94821,Repellat repellendus vitae cum quibusdam dolorum. maintenance,decommissioned
80982,Maiores quasi quas dolorem numquam. maintenance,decommissioned
84835,Labore minus qui minima. maintenance,decommissioned
55971,Voluptas delectus voluptates nam distinctio vel. maintenance,functional
4891,Iusto repellendus mollitia quisquam repellendus. maintenance,functional
42783,Harum consequatur hic cupiditate omnis ipsum porro. maintenance,functional
58564,Natus pariatur iste ipsam iure. maintenance,repair
32959,Enim facilis ducimus. maintenance,functional
69265,Repellat modi nemo. maintenance,repair
63110,Illum doloribus laboriosam consequatur. maintenance,repair
37752,Inventore consectetur hic eos repudiandae. maintenance,decommissioned
70246,Nesciunt fuga est fugit. maintenance,decommissioned
7866,Eveniet in hic aut voluptatem. maintenance,repair
47716,Eveniet enim consequatur veritatis reiciendis minus. maintenance,repair
2401,Doloremque adipisci eum nobis consequuntur aut. maintenance,functional
69479,Doloremque omnis minima labore. maintenance,functional
85181,Fugit occaecati culpa incidunt sapiente quibusdam culpa. maintenance,repair
20823,Numquam quibusdam voluptatem minus tenetur unde quis temporibus. maintenance,functional
29499,Voluptatibus eos natus ab. maintenance,repair
95560,Praesentium perspiciatis optio assumenda tenetur tenetur. maintenance,repair
21566,Nobis similique dolore nemo adipisci voluptates. maintenance,repair
86627,Culpa molestias nisi voluptates. maintenance,functional
70094,Voluptate natus similique nesciunt nobis. maintenance,decommissioned
81983,Nostrum deserunt nostrum aliquid dolorum. maintenance,functional
82368,Dolore soluta laborum ipsam. maintenance,repair
28088,Tenetur impedit itaque corrupti asperiores. maintenance,repair
70896,Nihil esse consectetur facilis laborum provident. maintenance,repair
79456,Culpa possimus vel a repellat earum. maintenance,functional
81959,Nisi deserunt temporibus neque vero autem tempore repellat. maintenance,functional
44661,Accusantium repellat iste aspernatur. maintenance,functional
25242,Tenetur magnam corporis harum eius nemo. maintenance,repair
73110,Dolore officia neque ipsa quam quod alias. maintenance,decommissioned
68493,Impedit ipsam numquam ab. maintenance,functional
40514,Odit quas quos beatae voluptate. maintenance,decommissioned
40795,Veniam quibusdam quo quis nihil nostrum vero. maintenance,functional
26854,Quisquam tempore omnis delectus explicabo suscipit. maintenance,decommissioned
33388,Nobis nobis repellendus eum dolorem itaque. maintenance,decommissioned
88557,Saepe aliquid hic sequi molestias optio hic. maintenance,functional
56028,Explicabo rem id nemo neque blanditiis similique. maintenance,decommissioned
70063,Ducimus soluta reprehenderit nemo aperiam libero. maintenance,decommissioned
79256,Animi autem neque voluptatem inventore perferendis explicabo. maintenance,functional
47540,Vel non commodi maxime. maintenance,decommissioned
90395,Ut saepe deserunt hic delectus. maintenance,decommissioned
93361,Expedita quibusdam suscipit ex. maintenance,decommissioned
20832,Iusto amet iste amet voluptatem voluptate fuga. maintenance,repair
65666,Labore voluptatem impedit est maxime. maintenance,functional
27601,Officiis corrupti soluta voluptates quia voluptates nam earum. maintenance,decommissioned
59633,Culpa quia nesciunt esse temporibus ad quae. maintenance,functional
62539,Iusto laboriosam pariatur tempore quisquam cupiditate at. maintenance,repair
71238,Nisi nobis repellendus magnam rem mollitia dicta. maintenance,functional
36963,Occaecati ipsam facilis cum dolore iusto. maintenance,repair
59951,Veritatis ratione omnis porro accusantium cupiditate. maintenance,functional
85928,Consequatur aliquam fugiat laborum quia voluptatum atque sunt. maintenance,decommissioned
3807,Animi consequuntur cumque veniam cumque natus. maintenance,decommissioned
55098,Molestias maiores necessitatibus sapiente voluptatum facere. maintenance,repair
93591,Exercitationem eaque doloremque animi qui minima deserunt. maintenance,decommissioned
54649,Ratione pariatur recusandae voluptate maxime quidem ipsam. maintenance,functional
71147,Deleniti velit commodi adipisci maiores placeat praesentium. maintenance,decommissioned
95387,Sint quas dolorem nihil a. maintenance,repair
9126,Rerum nulla libero maxime dolore porro. maintenance,functional
24083,Voluptatum corporis quos natus itaque molestiae sunt. maintenance,repair
36118,Labore libero molestias natus enim qui. maintenance,decommissioned
8276,Eveniet eligendi repellat vero repellendus repudiandae eum. maintenance,repair
8802,Dicta corporis delectus ipsam dolore. maintenance,functional
94760,Libero tempora perferendis reiciendis nulla. maintenance,repair
21154,Nobis mollitia omnis temporibus. maintenance,functional
33840,Eum ullam numquam minima. maintenance,repair
56721,Accusantium aspernatur consequatur. maintenance,functional
67247,Eius veniam voluptatibus expedita minima. maintenance,functional
13757,A minus provident tenetur animi sapiente natus. maintenance,functional
67679,Tempora molestias odit odio dolorem id. maintenance,functional
49906,Nulla suscipit eaque commodi. maintenance,functional
58954,Harum nulla repellendus ex modi dignissimos. maintenance,functional
60821,Quis quia dolores quaerat. maintenance,repair
85320,Vero dolores voluptatibus sed. maintenance,decommissioned
99892,Dolore expedita at. maintenance,repair
67334,Aspernatur sint perferendis hic nemo sit quisquam. maintenance,functional
35442,Quidem minima pariatur corporis blanditiis unde. maintenance,decommissioned
802,Sunt architecto incidunt magnam temporibus soluta ratione. maintenance,functional
48529,Ut a earum quos porro. maintenance,functional
25574,Doloremque sequi harum fuga. maintenance,repair
34862,Voluptatibus commodi aspernatur deserunt magni necessitatibus est. maintenance,decommissioned
63181,Aliquid architecto qui soluta ab quasi quaerat. maintenance,decommissioned
64574,Corrupti fugit repellat nisi. maintenance,repair
74172,Eos quisquam officia est. maintenance,repair
34615,Earum optio quidem voluptatem iste sequi provident. maintenance,functional
74916,Expedita laborum ex debitis atque fugiat culpa. maintenance,decommissioned
29787,Ipsum eaque numquam. maintenance,decommissioned
23197,Placeat expedita tenetur ducimus commodi ullam. maintenance,decommissioned
43646,Corrupti culpa minus officia autem ea laboriosam. maintenance,functional
5369,Ea omnis qui esse tenetur similique. maintenance,functional
46224,Labore minus a non. maintenance,functional
26326,Veritatis sed reiciendis. maintenance,repair
40091,Velit enim similique unde aut. maintenance,repair
4250,Similique exercitationem voluptate voluptates corrupti. maintenance,functional
84638,Optio vero laboriosam natus maiores. maintenance,functional
56344,Officiis odio voluptates eius perferendis impedit veniam. maintenance,functional
93935,Dolor rerum assumenda repudiandae et adipisci. maintenance,repair
82618,Molestiae assumenda adipisci excepturi necessitatibus perspiciatis aliquam. maintenance,repair
62199,Mollitia reiciendis fuga voluptas qui tempore impedit sapiente. maintenance,decommissioned
22450,Consequuntur sed quaerat totam sapiente. maintenance,decommissioned
61137,Veniam reprehenderit animi magnam incidunt id. maintenance,functional
98800,Autem veritatis corrupti consectetur odio at cumque. maintenance,decommissioned
1379,Nam dignissimos laboriosam itaque officiis. maintenance,functional
64155,Ipsam deserunt repellendus iusto distinctio natus vel. maintenance,functional
86332,Magnam consectetur beatae itaque recusandae laboriosam repellendus. maintenance,repair
4485,Consequatur est beatae deserunt nobis. maintenance,functional
84629,Architecto possimus aspernatur cupiditate beatae quasi natus totam. maintenance,functional
12809,Maxime corporis atque veritatis voluptatem laudantium. maintenance,repair
34645,Explicabo quae ratione omnis vitae velit. maintenance,functional
66911,Non vel dolores doloremque assumenda enim. maintenance,repair
20128,Culpa non amet. maintenance,repair
74356,Maxime placeat soluta nihil. maintenance,decommissioned
27786,Illo fuga doloribus distinctio magni sint. maintenance,functional
93929,Dignissimos inventore facere deserunt odit. maintenance,decommissioned
18276,Quis voluptas maxime excepturi necessitatibus qui nemo. maintenance,repair
45455,Ducimus eligendi aliquid dolorum reprehenderit ipsam. maintenance,decommissioned
49989,Perferendis cumque iusto quod nisi. maintenance,functional
41457,Magni laboriosam tempora laborum. maintenance,functional
92552,Cum illum recusandae maxime. maintenance,repair
21619,Recusandae repudiandae sunt ratione tenetur. maintenance,functional
65041,Excepturi nulla nemo dicta. maintenance,functional
49445,Necessitatibus voluptatum voluptate laborum delectus odio sunt. maintenance,repair
11612,Fugit repudiandae voluptates. maintenance,functional
25009,Incidunt tempore dolorum aliquam. maintenance,repair
46482,Placeat et perferendis similique assumenda nobis. maintenance,repair
89687,Unde tenetur tempora laborum inventore cum vel. maintenance,functional
31687,Rerum illo recusandae. maintenance,repair
47753,Eius vero modi officiis quod. maintenance,repair
3965,Delectus voluptatum tempore assumenda dicta suscipit. maintenance,decommissioned
83307,Unde sapiente dolorum iusto. maintenance,functional
14684,Quidem iste praesentium veniam labore aperiam numquam placeat. maintenance,decommissioned
77887,Quae vel harum incidunt. maintenance,repair
78830,Optio modi quia inventore deserunt facilis pariatur. maintenance,decommissioned
57999,Porro voluptatibus sint reprehenderit quisquam ipsa doloribus. maintenance,functional
62058,Animi sint sequi quaerat. maintenance,decommissioned
46766,Esse occaecati unde optio omnis quo incidunt reiciendis. maintenance,functional
60026,Cumque voluptas rem asperiores eos voluptatibus. maintenance,functional
64697,Rerum deleniti culpa deleniti ut exercitationem officiis sunt. maintenance,functional
52822,Veritatis tempora similique. maintenance,repair
70214,Quia eaque expedita officia harum eos. maintenance,repair
84233,Accusantium dicta pariatur repellendus eum voluptas corrupti. maintenance,functional
63625,Sapiente velit quos explicabo occaecati similique. maintenance,repair
478,Neque accusantium et ut. maintenance,decommissioned
32800,Totam nemo dolor saepe dolore sit vel. maintenance,repair
86508,Repellendus nisi enim veritatis sit officia. maintenance,decommissioned
90103,Repudiandae dolor culpa. maintenance,decommissioned
96539,Nobis facilis corporis voluptate voluptates. maintenance,functional
94419,Ipsa accusamus est fuga sapiente excepturi odit. maintenance,decommissioned
64974,Ipsa necessitatibus dolore neque reprehenderit sint similique corrupti. maintenance,decommissioned
35443,Nobis eum repellendus illo numquam quas. maintenance,repair
70325,Nemo ratione corporis blanditiis suscipit. maintenance,decommissioned
94212,Inventore enim magnam incidunt. maintenance,repair
96775,Velit consequuntur nobis eos. maintenance,repair
8308,Nulla harum vitae iusto soluta omnis. maintenance,decommissioned
96574,A dolores quod eligendi accusamus. maintenance,repair
19230,Impedit praesentium veniam odio molestiae debitis. maintenance,repair
98060,Beatae nemo facilis aut. maintenance,decommissioned
41740,Distinctio cum nobis facere. maintenance,decommissioned
34585,Officiis provident et rem voluptate. maintenance,repair
15863,Vel nesciunt sequi nostrum ullam ducimus mollitia. maintenance,decommissioned
69617,Pariatur ut eligendi iusto. maintenance,decommissioned
93536,Temporibus eum reprehenderit tenetur voluptate autem architecto aliquam. maintenance,functional
4059,Repellendus reiciendis nostrum recusandae animi sapiente. maintenance,decommissioned
46626,Vel minima esse laborum blanditiis eaque quasi. maintenance,functional
64553,Suscipit tempora placeat consectetur assumenda voluptates officiis. maintenance,decommissioned
49661,Magnam optio odio accusantium. maintenance,repair
58294,Dolores dolores quia aut. maintenance,decommissioned
55699,Natus atque ad nostrum dolore voluptas. maintenance,repair
15145,Facilis eaque earum velit nostrum distinctio. maintenance,decommissioned
15948,Exercitationem molestiae dolor exercitationem ducimus. maintenance,functional
29307,Maiores perferendis corporis accusamus deleniti laborum. maintenance,decommissioned
26158,Totam amet repellat harum mollitia vero veniam numquam. maintenance,decommissioned
16188,Molestias libero ducimus esse nihil magnam dolorem. maintenance,functional
48977,Ut veritatis recusandae enim facilis. maintenance,repair
50838,Quod cumque exercitationem. maintenance,functional
89927,Quod incidunt deleniti. maintenance,functional
41967,Dicta tenetur sunt praesentium. maintenance,decommissioned
