record_ID,Description,Status
53350,Vel maxime dolorum voluptate enim maiores beatae ullam. maintenance,repair
52504,Provident nihil porro omnis esse minima. maintenance,decommissioned
32048,Repellendus eligendi adipisci ab. maintenance,decommissioned
10710,Eligendi voluptate ducimus. maintenance,functional
83110,Perspiciatis quasi beatae excepturi hic unde. maintenance,functional
5915,Mollitia labore fuga quo quas impedit. maintenance,functional
81810,Quisquam corrupti inventore illum necessitatibus hic. maintenance,decommissioned
28543,Eligendi nulla recusandae recusandae quasi. maintenance,decommissioned
86378,Amet provident sunt et asperiores ex nihil. maintenance,functional
83997,Debitis ab quaerat hic id occaecati. maintenance,repair
14105,Totam eos fuga ea pariatur. maintenance,decommissioned
23544,Officia non alias aliquid. maintenance,decommissioned
17308,Mollitia consequuntur quibusdam ab. maintenance,decommissioned
12056,Doloribus pariatur blanditiis nulla. maintenance,functional
14436,Perspiciatis distinctio maiores cum error doloribus facere. maintenance,repair
25639,Dolorum id sunt atque praesentium. maintenance,decommissioned
54415,Voluptate error itaque veritatis doloremque. maintenance,repair
45804,Pariatur delectus aperiam odio. maintenance,repair
16530,Provident sequi labore quisquam id. maintenance,decommissioned
50904,Enim beatae dicta veniam. maintenance,repair
73833,Unde saepe incidunt quaerat. maintenance,repair
57834,Quo velit iure asperiores. maintenance,decommissioned
35553,Error illum voluptatibus laudantium in aspernatur expedita. maintenance,decommissioned
55702,Autem unde eveniet dignissimos voluptatem assumenda cupiditate. maintenance,decommissioned
65017,Omnis accusantium eum. maintenance,functional
10623,Non quas numquam quasi nostrum. maintenance,functional
85855,In aspernatur qui minima velit minima. maintenance,decommissioned
3752,Ipsa cupiditate sed quod est beatae deleniti. maintenance,decommissioned
75437,Dolor minus necessitatibus incidunt soluta adipisci facilis. maintenance,repair
32879,Quaerat autem eveniet suscipit. maintenance,functional
93623,Possimus aliquam quod. maintenance,repair
3764,Nemo quidem minus dolorum blanditiis qui veniam. maintenance,functional
12464,Velit itaque nisi quidem. maintenance,decommissioned
70949,Omnis dolorum similique sed soluta porro. maintenance,decommissioned
38820,Natus quas accusantium odit perspiciatis a officia optio. maintenance,functional
88259,Sequi delectus magni sint sapiente excepturi quia ex. maintenance,functional
8296,Tenetur recusandae odit atque ducimus fuga commodi. maintenance,functional
17605,Iusto cumque ipsam eum tempora aperiam. maintenance,repair
14971,Enim eaque odio quis. maintenance,repair
36422,Molestiae quo eos in soluta sunt. maintenance,repair
69091,Excepturi porro hic repudiandae dolorum. maintenance,repair
22723,Tempore rerum vitae natus repellendus accusantium optio. maintenance,repair
17486,Cupiditate quam cupiditate reprehenderit. maintenance,decommissioned
27643,Rem fugiat fugiat cupiditate voluptate excepturi. maintenance,repair
63107,Repellat voluptatem culpa accusantium repellat. maintenance,functional
99146,Impedit dolores nulla laborum sit placeat. maintenance,repair
59826,Reprehenderit labore ratione maxime. maintenance,functional
24535,Ullam laborum placeat tempora delectus. maintenance,decommissioned
24234,Dolores ea at soluta necessitatibus repellat. maintenance,decommissioned
74121,Consequatur iure aspernatur ducimus similique quia. maintenance,repair
78064,Illo natus ipsa tenetur delectus nobis ex. maintenance,functional
62809,Inventore quae sunt nisi perferendis aperiam. maintenance,functional
70976,Quibusdam aliquam eveniet quidem modi officiis. maintenance,decommissioned
741,Quod vel accusantium cumque quidem quia alias dicta. maintenance,repair
59445,Deserunt voluptatum veniam amet ipsum reiciendis magnam. maintenance,decommissioned
83818,In possimus recusandae pariatur. maintenance,decommissioned
75411,Sint natus ad vitae explicabo. maintenance,functional
48545,Maiores labore tempora unde. maintenance,functional
27953,Illum iure cum neque. maintenance,decommissioned
5819,Quisquam illo dolorem officia hic provident ipsum. maintenance,decommissioned
43212,Ducimus cum nam a tempore nesciunt. maintenance,functional
56019,Repellat at laboriosam tempora atque voluptatum tempora. maintenance,repair
82788,Doloremque blanditiis quibusdam aliquam. maintenance,repair
85124,Earum quia ullam atque amet eveniet. maintenance,decommissioned
51558,Sunt similique nostrum in dignissimos deserunt fugiat cumque. maintenance,decommissioned
6502,Quasi laudantium saepe dignissimos debitis error. maintenance,repair
93696,Voluptate corrupti dignissimos suscipit quisquam. maintenance,functional
75993,Placeat ad ducimus totam. maintenance,decommissioned
68236,Ut placeat eum. maintenance,decommissioned
75475,Tempora dolor tempore ex optio. maintenance,functional
90717,Excepturi aliquid natus fugiat soluta adipisci. maintenance,repair
73588,At eligendi amet ipsam. maintenance,repair
97160,Voluptates quaerat eaque. maintenance,decommissioned
78825,Sapiente ullam a quia reprehenderit illo quasi quia. maintenance,repair
28447,Inventore tenetur est reprehenderit perferendis corrupti pariatur. maintenance,decommissioned
17860,Ea eos architecto repellendus. maintenance,decommissioned
48847,Reprehenderit officia dolorem eum optio odit quia quam. maintenance,functional
79535,Occaecati sint iusto ad aspernatur. maintenance,decommissioned
10254,Nihil vel ea. maintenance,repair
33185,Incidunt dignissimos architecto cupiditate necessitatibus maxime. maintenance,functional
12163,Eos laboriosam quo non esse. maintenance,repair
35947,Ullam iure necessitatibus. maintenance,decommissioned
10824,Nam vitae ad laudantium vel veritatis ad soluta. maintenance,repair
25988,Error culpa dolores in rerum distinctio. maintenance,functional
49300,Possimus voluptatibus maiores qui. maintenance,functional
25235,Eius odio et eaque molestiae. maintenance,decommissioned
909,Veniam ex eaque recusandae iste corporis. maintenance,repair
5595,Velit sapiente assumenda commodi nobis unde dolorum. maintenance,decommissioned
23280,Voluptatibus a reprehenderit accusamus mollitia. maintenance,functional
16402,Unde inventore incidunt omnis dolorum laborum. maintenance,decommissioned
69704,Minima modi perferendis labore. maintenance,repair
95363,Quo quisquam earum a. maintenance,decommissioned
79579,Animi iure voluptates natus nulla reprehenderit quos. maintenance,functional
7849,Ad officia quam accusamus odio fuga quam fugiat. maintenance,repair
51335,Praesentium perferendis quos necessitatibus repellendus. maintenance,decommissioned
75081,Dolores repudiandae sequi quas reprehenderit. maintenance,decommissioned
70097,Esse natus ab provident omnis laboriosam exercitationem. maintenance,functional
77352,Inventore ullam hic consequuntur quia a expedita excepturi. maintenance,functional
19419,Neque quam reiciendis iure rerum. maintenance,functional
86417,Sequi praesentium excepturi non sequi. maintenance,functional
15495,Nobis eum eligendi repudiandae. maintenance,repair
18386,Ad ipsum expedita impedit ut itaque eos. maintenance,decommissioned
11211,Eius animi possimus numquam ex repudiandae provident. maintenance,functional
12323,Quae error quibusdam nulla impedit. maintenance,repair
51965,Eius enim sequi nostrum dolorem ab ratione. maintenance,decommissioned
49652,Nesciunt corporis eligendi nobis odit quasi. maintenance,repair
54220,Porro dolor recusandae molestiae consequatur maxime aliquid. maintenance,repair
65565,Deleniti odio incidunt eius illo voluptatum reprehenderit. maintenance,functional
65929,Neque corporis magnam illo cupiditate. maintenance,repair
78074,Voluptatum voluptatibus labore minima. maintenance,decommissioned
8862,Dignissimos voluptate impedit commodi sapiente. maintenance,functional
14468,Enim assumenda repellat nemo velit ab corrupti. maintenance,functional
27439,Vel praesentium voluptate placeat sapiente quaerat incidunt. maintenance,functional
72813,Aut quaerat iure. maintenance,repair
68547,Hic officia temporibus vitae similique consequuntur aliquam. maintenance,decommissioned
12214,Asperiores nostrum iure sit. maintenance,decommissioned
87875,Magnam saepe a odit. maintenance,decommissioned
17154,Consequuntur culpa laudantium iusto alias dicta itaque. maintenance,functional
8012,Rem voluptates placeat hic cum repellat exercitationem. maintenance,functional
19211,Magni voluptate ad totam soluta animi nesciunt placeat. maintenance,functional
4917,Aspernatur sed numquam quod ut. maintenance,decommissioned
43444,Architecto soluta animi eius soluta reiciendis tempore. maintenance,repair
26911,Velit aliquid quis illo laudantium expedita. maintenance,decommissioned
24768,Nobis enim enim unde aspernatur accusamus laborum non. maintenance,repair
47776,Voluptatibus sint cupiditate rem. maintenance,decommissioned
16632,Possimus doloremque voluptates similique architecto officia. maintenance,decommissioned
42945,Nam quaerat earum eaque laborum atque libero. maintenance,functional
50137,Similique optio laborum quam architecto corrupti. maintenance,repair
8767,Quam adipisci expedita voluptas omnis nam. maintenance,repair
22719,Praesentium ex quod dolorem quam porro expedita. maintenance,decommissioned
76334,Quam consequatur saepe qui dicta. maintenance,repair
30407,Dicta beatae soluta distinctio animi odit ad sint. maintenance,functional
11238,Nisi numquam fugit voluptates cumque. maintenance,repair
64273,Ducimus qui omnis ducimus. maintenance,functional
66244,Porro fugiat amet reiciendis maiores voluptate. maintenance,decommissioned
33621,Eos veritatis cupiditate provident eius. maintenance,functional
7096,Dolorem in incidunt exercitationem assumenda repellendus. maintenance,functional
88790,Maxime deserunt doloremque fuga eaque voluptatem. maintenance,functional
64089,Ea dolorem animi voluptatibus voluptatem. maintenance,repair
31260,Vitae corporis architecto dolore possimus distinctio soluta. maintenance,repair
63704,Quam cum cum distinctio vitae repudiandae. maintenance,decommissioned
11941,Adipisci voluptatum sequi quisquam consectetur debitis. maintenance,repair
24016,Quo quibusdam ipsam consectetur delectus eum aliquam. maintenance,functional
78805,Earum quos molestiae modi enim eius doloremque dolorem. maintenance,decommissioned
6903,Sapiente repudiandae deleniti eum aut dicta. maintenance,repair
95762,Magnam quasi quisquam illum voluptas cumque. maintenance,repair
29469,Necessitatibus saepe illo consequatur mollitia rem. maintenance,repair
14104,Corporis harum magni sed error corporis quo. maintenance,repair
79985,Eveniet iusto dolorum vitae fuga accusamus. maintenance,decommissioned
21709,In accusantium odio neque pariatur libero. maintenance,functional
2637,Provident fuga soluta soluta ut rem quo dicta. maintenance,functional
60375,Veritatis nisi cumque eos. maintenance,repair
56123,Nemo doloribus nihil dolores. maintenance,repair
53580,Vero porro ad porro sed. maintenance,decommissioned
98751,Blanditiis nihil quas repellat. maintenance,functional
87232,Amet minima dolor nesciunt. maintenance,decommissioned
80620,Consectetur nemo corrupti quis earum dignissimos. maintenance,functional
24459,Aspernatur corporis quasi earum. maintenance,functional
2763,Aliquid impedit corporis error vel enim. maintenance,functional
49320,Animi id fugit veritatis quod omnis. maintenance,functional
96002,Voluptatem nihil quaerat quidem iste libero rerum. maintenance,functional
37168,Occaecati culpa dolores. maintenance,functional
48937,Consectetur tenetur dolorem facere explicabo. maintenance,functional
40272,Delectus eaque quia tempora sit labore facere. maintenance,decommissioned
94262,Maxime magni corporis corporis. maintenance,decommissioned
55986,Quisquam assumenda vel ipsa. maintenance,repair
68123,Voluptate provident fugit commodi repudiandae. maintenance,decommissioned
41893,Quos recusandae vitae sunt sapiente. maintenance,repair
95995,Quisquam tempore officia occaecati ipsa quaerat itaque. maintenance,decommissioned
2435,Rem dolores ad optio debitis. maintenance,repair
59418,Modi quos odio. maintenance,repair
6036,Quibusdam ratione consectetur numquam. maintenance,decommissioned
34772,Labore possimus in cum sunt non. maintenance,functional
1455,Doloribus atque dolorum. maintenance,decommissioned
83789,Numquam error odio necessitatibus ipsum asperiores. maintenance,repair
88696,Deserunt quis pariatur nisi asperiores repellat quia voluptate. maintenance,decommissioned
11662,Quaerat quisquam natus error quisquam. maintenance,repair
40219,Eveniet quisquam quasi sed quo perspiciatis corrupti. maintenance,repair
74708,Excepturi velit a itaque dolores occaecati. maintenance,functional
53329,Totam ullam blanditiis aperiam omnis molestiae. maintenance,repair
25868,Repudiandae mollitia non quam totam. maintenance,functional
66476,Sapiente modi asperiores architecto maxime sequi. maintenance,repair
92294,Alias qui dolores sunt. maintenance,functional
17928,Tempore corporis rerum nisi facilis dolorem amet. maintenance,decommissioned
22853,Non assumenda quasi voluptate nobis. maintenance,decommissioned
36916,Alias eveniet consequatur tempore eius minima. maintenance,repair
24776,Eligendi deserunt sapiente harum at in. maintenance,functional
76308,Nulla praesentium aut tempore ratione. maintenance,repair
22316,Temporibus odit dolorem voluptatem assumenda et ullam. maintenance,functional
88943,Qui dolorem voluptatibus beatae. maintenance,functional
39680,Inventore repellat temporibus adipisci libero. maintenance,decommissioned
30019,Quod maxime commodi suscipit provident porro. maintenance,repair
19252,Fuga recusandae odio beatae similique non. maintenance,functional
51718,Explicabo hic provident vitae. maintenance,repair
59015,Dolores unde quae nesciunt repellat. maintenance,decommissioned
62608,Ipsam sint rerum consequuntur. maintenance,repair
31193,Possimus voluptate repudiandae maxime minima nesciunt nisi. maintenance,decommissioned
73511,Iste incidunt magnam repudiandae cum. maintenance,functional
91375,Dolor deleniti accusamus quibusdam sint. maintenance,functional
91357,Ea earum numquam fuga ut aperiam maxime saepe. maintenance,decommissioned
76132,Earum perferendis ipsam voluptas. maintenance,functional
70271,Id perspiciatis quo odio. maintenance,functional
21279,Officiis aliquid cum dolorem. maintenance,functional
91122,Officia fuga provident sapiente accusantium. maintenance,repair
68428,Aspernatur reiciendis sequi impedit impedit quae. maintenance,functional
22389,Quos eius est velit eveniet. maintenance,functional
21048,Dicta temporibus non. maintenance,repair
73505,Vitae dolor tempora atque eius omnis. maintenance,decommissioned
95874,Vitae et mollitia enim sunt cumque. maintenance,repair
79290,Quo praesentium alias quas. maintenance,functional
10517,Vero modi vel molestias occaecati. maintenance,functional
53802,Esse repellat alias dignissimos quo. maintenance,repair
83887,Quas suscipit quas sunt suscipit tempora dignissimos. maintenance,repair
40810,Praesentium pariatur adipisci nobis nisi officiis molestiae. maintenance,functional
2277,Nam quae ut harum repudiandae voluptates. maintenance,functional
59193,Est molestias autem vero doloremque ipsa tenetur. maintenance,decommissioned
52879,Tempora explicabo repellat totam aspernatur modi. maintenance,functional
1000,Quo corporis fugit ipsa. maintenance,decommissioned
17907,Repellendus ab rem laboriosam. maintenance,functional
768,Non autem eaque. maintenance,functional
66870,Et nam ducimus nisi reiciendis ducimus vero. maintenance,decommissioned
39743,Ea quia nesciunt. maintenance,repair
14207,Eos aliquam vero vel ut consequatur. maintenance,decommissioned
35218,Ullam consequatur numquam fuga odio molestiae. maintenance,repair
53490,Numquam provident quam earum error. maintenance,functional
8444,Cumque atque ipsum ipsum. maintenance,repair
72383,Repellat odio voluptate sed. maintenance,decommissioned
96664,Numquam ex omnis inventore maxime. maintenance,repair
63543,Aut dolorem expedita facilis error iure quidem. maintenance,repair
97111,Quod iste esse hic. maintenance,repair
62647,Unde ducimus culpa recusandae. maintenance,repair
51685,Eveniet minus asperiores earum molestiae est. maintenance,decommissioned
36185,Cumque accusamus repudiandae molestiae unde. maintenance,decommissioned
29380,Corporis ut commodi modi voluptatem quos. maintenance,decommissioned
9746,Adipisci officia quis eius. maintenance,decommissioned
29269,Magni enim perferendis vero maiores aliquid optio nulla. maintenance,functional
79192,Odit cupiditate accusantium eveniet maiores nisi. maintenance,repair
70987,Optio tempora possimus consectetur voluptate illum. maintenance,repair
3893,Recusandae minima laudantium veniam voluptatum beatae. maintenance,decommissioned
97911,Doloribus quis error quasi. maintenance,repair
10311,Delectus quidem alias minima fuga. maintenance,repair
61386,Iste quia libero quidem saepe corrupti. maintenance,functional
22711,Quis tempora natus a nihil tempora praesentium. maintenance,decommissioned
87386,Unde eaque ipsam provident. maintenance,repair
7054,Deleniti commodi laboriosam voluptatem harum impedit porro. maintenance,decommissioned
94685,Voluptatem reiciendis placeat temporibus in in. maintenance,functional
53473,Rerum recusandae saepe aut. maintenance,functional
28214,Accusantium earum molestiae minima dicta. maintenance,functional
43608,Minus error sint inventore. maintenance,repair
4309,Beatae assumenda qui excepturi vel. maintenance,decommissioned
47065,Voluptatibus amet asperiores quae. maintenance,repair
67864,Aliquam est quae doloribus excepturi minima sunt. maintenance,decommissioned
15741,Reiciendis error dignissimos sit ducimus ut. maintenance,functional
9117,Neque fugit suscipit maiores. maintenance,functional
96809,Pariatur dolorum voluptatem fugit ullam. maintenance,functional
25557,Ex hic expedita quae. maintenance,functional
42983,Soluta corporis perspiciatis incidunt suscipit iusto nisi. maintenance,decommissioned
72615,Aliquam quasi error modi. maintenance,decommissioned
1046,Iusto rem fugit maiores iste soluta ut. maintenance,decommissioned
67431,Tempora reiciendis perspiciatis odit asperiores nisi quidem. maintenance,functional
40728,Asperiores fugiat saepe ipsum possimus sit. maintenance,decommissioned
34316,Ipsa voluptatem dolorum dignissimos dolorum. maintenance,functional
85923,Sapiente totam aperiam in vitae porro. maintenance,decommissioned
87319,Occaecati accusamus perspiciatis eaque placeat voluptatem officiis. maintenance,decommissioned
99251,Iste ratione voluptate alias alias. maintenance,functional
94068,Incidunt vel magnam dolor dicta perspiciatis consequuntur veritatis. maintenance,decommissioned
50354,Blanditiis id ullam perferendis. maintenance,repair
59451,Vero officia nisi vitae ad. maintenance,repair
89019,Fugit iusto deleniti quas commodi doloribus voluptatem. maintenance,functional
71110,Harum laboriosam fuga voluptatum tempora aspernatur. maintenance,decommissioned
84704,Deserunt ipsam tenetur aut eligendi omnis est quam. maintenance,functional
51967,Ullam totam at autem optio vero. maintenance,functional
40039,Quod distinctio animi quasi rerum vero. maintenance,repair
81259,Molestias perspiciatis animi odit exercitationem culpa. maintenance,repair
49785,Consequuntur reiciendis voluptatum placeat est. maintenance,functional
97353,Debitis totam adipisci possimus accusamus eum. maintenance,repair
70225,Animi repellat praesentium cum aspernatur nisi. maintenance,functional
76428,Totam quaerat rem vitae voluptatum quo. maintenance,decommissioned
505,Nisi sit iste error optio delectus nesciunt itaque. maintenance,repair
92094,Quos quam veniam praesentium deserunt amet quasi. maintenance,decommissioned
28938,Provident quidem a ullam eaque. maintenance,functional
5255,Ea velit nihil nihil iure magnam repellendus. maintenance,repair
92512,Similique provident nihil. maintenance,decommissioned
10437,Assumenda aperiam officia enim saepe ipsam. maintenance,functional
16263,Ipsum ea voluptate. maintenance,functional
96628,Reiciendis neque occaecati molestiae. maintenance,decommissioned
36104,Omnis beatae officiis aut voluptatem aspernatur. maintenance,functional
42665,Similique unde repellat in nesciunt voluptatum ratione. maintenance,repair
7719,Optio aut quidem tempore nesciunt dolorem. maintenance,decommissioned
11736,Adipisci eius impedit explicabo iusto. maintenance,repair
93663,Accusantium perferendis sapiente ex placeat velit ad. maintenance,repair
76694,Quis dicta vitae aperiam reprehenderit atque. maintenance,functional
47445,Praesentium repellat quasi vitae illum magni doloribus ex. maintenance,decommissioned
54018,Delectus nulla eius et suscipit modi dolores. maintenance,repair
90410,Corrupti harum nihil. maintenance,repair
12008,Animi consectetur minima doloremque recusandae vel mollitia. maintenance,functional
259,Quia facere iusto sunt necessitatibus architecto suscipit. maintenance,functional
33414,Nisi ex laudantium praesentium mollitia quisquam aliquid fugit. maintenance,decommissioned
48054,Accusantium error eos tempora error quaerat. maintenance,decommissioned
39245,Aspernatur hic voluptatum excepturi sint aliquid vitae. maintenance,functional
90028,Consequatur odio maiores tempore aperiam suscipit dolorem. maintenance,repair
34546,Error voluptatum a atque non aperiam magni. maintenance,repair
40761,Perferendis dolor nostrum ratione. maintenance,repair
49331,Culpa quisquam nisi adipisci illo odio. maintenance,repair
36078,Maiores suscipit excepturi animi placeat. maintenance,decommissioned
23802,Blanditiis voluptas quis assumenda quam id ipsam quas. maintenance,functional
77793,Voluptas dolorem earum aspernatur fugiat blanditiis quas. maintenance,repair
56006,Accusamus ipsa itaque consectetur est debitis doloremque. maintenance,repair
2171,Tempore voluptas iste labore ullam. maintenance,functional
14561,Voluptas non dolores occaecati optio inventore libero. maintenance,repair
58375,Excepturi illo natus odit modi. maintenance,repair
80459,Minus magni ipsam minima quos totam. maintenance,decommissioned
10978,Occaecati architecto dolorum. maintenance,repair
99506,Corrupti vitae nihil ratione quis iure vel. maintenance,functional
34340,Libero voluptatum nulla ex sit suscipit voluptatibus. maintenance,repair
5578,Voluptas soluta nisi praesentium harum eaque. maintenance,repair
18786,Perspiciatis impedit maiores laboriosam nostrum nostrum. maintenance,decommissioned
84413,Asperiores nam quisquam omnis consectetur. maintenance,decommissioned
64136,Unde facere libero corrupti earum consectetur quasi facere. maintenance,decommissioned
63934,Corporis magni at facilis est consectetur. maintenance,decommissioned
50194,Quis maiores cumque inventore fugiat corrupti ut. maintenance,decommissioned
21290,Dolores praesentium asperiores. maintenance,repair
2422,Sed veniam error reiciendis in ex illo. maintenance,functional
10772,Sunt nemo rerum aut praesentium accusantium officiis dolor. maintenance,functional
33435,Iure dolorum quisquam inventore repellendus ex. maintenance,repair
6058,Distinctio error ex tempora sit incidunt. maintenance,decommissioned
22047,Officiis fugit mollitia voluptas. maintenance,decommissioned
21163,Pariatur quaerat quaerat eius reiciendis asperiores expedita atque. maintenance,functional
94405,Dolorem dolorum officiis minima. maintenance,functional
37407,Enim temporibus veritatis cupiditate voluptatem. maintenance,decommissioned
65262,Optio ullam reprehenderit. maintenance,functional
30896,Consequuntur excepturi tenetur deleniti provident dolor. maintenance,decommissioned
88144,Et quaerat saepe. maintenance,decommissioned
84104,Modi temporibus voluptas assumenda molestias. maintenance,decommissioned
55746,Beatae inventore eos. maintenance,decommissioned
20011,Asperiores laborum tempore corporis id. maintenance,decommissioned
95579,Cumque modi corrupti at magni. maintenance,decommissioned
33226,Quod ex labore temporibus consequatur molestias. maintenance,decommissioned
22216,Inventore atque temporibus delectus eaque recusandae. maintenance,repair
5055,Necessitatibus unde error omnis assumenda dolorem odio. maintenance,decommissioned
66367,Illum natus magnam a. maintenance,decommissioned
4048,In quas ut dolore. maintenance,decommissioned
47999,Cum occaecati quaerat dolore. maintenance,decommissioned
35631,Nulla nulla omnis consequuntur ipsa. maintenance,decommissioned
68539,Porro iste laboriosam tempora beatae ipsum. maintenance,functional
94341,Rem nam beatae aspernatur. maintenance,functional
71783,Fuga deleniti hic sit culpa ullam enim. maintenance,repair
40929,Ratione magni atque nostrum. maintenance,repair
79042,Assumenda vero harum eos totam dolore. maintenance,repair
94505,Eligendi est unde vero molestiae. maintenance,repair
86572,Dolore possimus perspiciatis velit ullam consectetur. maintenance,decommissioned
75093,Quaerat a unde numquam ad officia. maintenance,decommissioned
44903,Nulla incidunt laborum reiciendis molestias minima non distinctio. maintenance,decommissioned
89394,Consequatur non sed maxime mollitia mollitia nihil blanditiis. maintenance,decommissioned
37564,Reprehenderit cumque sint blanditiis dolor. maintenance,decommissioned
12966,Exercitationem facere blanditiis ea rem consequatur hic. maintenance,decommissioned
4239,Iure odio exercitationem quas ipsam velit nemo incidunt. maintenance,decommissioned
54388,In aliquid maiores qui natus facilis culpa. maintenance,functional
65469,Corporis sunt labore. maintenance,decommissioned
9018,Id ducimus animi impedit. maintenance,decommissioned
45307,Necessitatibus illo aspernatur consequuntur quisquam fuga. maintenance,decommissioned
1567,Dolores quo accusamus quas ipsam occaecati incidunt. maintenance,functional
89986,Exercitationem totam id amet beatae delectus nulla. maintenance,decommissioned
17302,Dolor soluta ex nobis. maintenance,repair
